[
    {
        "user_input":"What is the page number for the table on total remuneration of management in key positions?",
        "retrieved_contexts":[
            "T 89\nin millions of euros\nGoods and Goods and services\nservices sold purchased Receivables Liabilities\n2024 2023 2024 2023 2024 2023 2024 2023\nJoint ventures 87 83 27 24 14 10 19 19\nAssociated entities and investees 17 55 29 20 13 25 18 102\nEntities not consolidated on materiality\ngrounds 213 113 125 207 152 209 55 86\nAll transactions with related parties were at arm\u2019s length. Total remuneration of key management personnel breaks\ndown as follows:\nTotal remuneration of key management personnel\nT 90\nThe key management personnel are the general partners of\nRobert Bosch Industrietreuhand KG and any limited part- in millions of euros\nners who are concurrently members of the board of manage-\n2024 2023\nment of Robert Bosch GmbH, as well as the members of the\nShort-term benefits 24 24\nsupervisory board and the members of the board of manage-\nPost-employment benefits 6 13\nment of Robert Bosch GmbH.\nOther long-term benefits 5 6\nTermination benefits 0 2\n4202\ntroper\nlaunnA\n186",
            "T 41 Goodwill by division 130 T 62 Reconciliation statements 156\n4202\ntroper\nlaunnA\nAdditional information\nList of graphs and tables\nThe Bosch Group Robert Bosch Stiftung Group management report Consolidated financial statements\n222288\nList of tables\nNo. Name Page No. Name Page\nT 63 Disclosures by important country 157 T 86 Leases: amounts recognized in the income\nstatement 183\nT 64 Net profit\/loss by category 161\nT 87 Due dates of receivables from finance leases 184\nT 65 Carrying amounts and fair values by category 162\nT 88 Outstanding minimum lease payments from\nT 66 Composition of the derivative financial\noperating leases 185\ninstruments 164\nT 89 Related party disclosures 186\nT 67 Derivation of fair values \u2013 reporting year 165\nT 90 Total remuneration of management in key\nT 68 Derivation of fair values \u2013 previous year 166\npositions 186\nT 69 Changes in financial assets allocated to level 3\nT 91 Auditor\u02bcs fees 187\nof the fair value hierarchy \u2013 reporting year 167",
            "Fees for\nment personnel.\nAudit services 9 8\nOther assurance services 1 1\n34 \u2014 Remuneration of members of the board\nof management and supervisory board Tax advisory services 1 1\nThe total remuneration of the members of the board of man- Other services 2 6\nagement comes to EUR 23 million in the fiscal year 2024\n(pre vious year: EUR 27 million), and that of the former mem-\nbers of the board of management and their dependants to 36 \u2014 Events after the reporting date\nEUR 21 million (previous year: EUR 22 million). An amount of The global tariff discussions, in particular the announce-\nEUR 268 million (previous year: EUR 275 million) has been ments made by the U.S. government in this regard, are ex-\naccrued for pension obligations to former members of the pected to have an impact on the Bosch Group, the extent of\nboard of management and their surviving dependants. which cannot be reliably estimated at present.",
            "- Reporting systems\n- Sanctions committee | 86\u201387; 91\u201392\nCollective knowledge of the highest governance body | - Goal agreements and management reviews | 09\u201311; 20\u201321\nEvaluation of the performance of the highest\ngovernance body | - Remuneration system\n- Goal agreements and management reviews | 9; 61\u201362; AR: 61\nRemuneration policies | - Remuneration system | None\nProcess to determine remuneration | None | None\nAnnual total compensation ratio | None | None\nStatement on sustainable development strategy | - Foreword | 3\u20135\nPolicy commitments | - Basic principles of social responsibility\n- Mission statement and values\n- Guidelines of Work Safety and Environmental\nProtection\n- Codes of conduct\n- Target vision | 9\u201311; 15\u201316; 20;\n24; 54; 56; 72;\n77\u201378; 86\u201389;\n91\u201394\nEmbedding policy commitments | - Selection, assessment, and further\ndevelopment of suppliers\n- Corporate Sustainability Board\n- Design for Environment\n- Human rights committee\n- Life cycle assessments",
            "to items in the statement of financial position 115\nT 48 Contingent liabilities 137\nT 25 Items for which no deferred taxes were\nT 49 Parameters for actuarial calculations 140\nrecognized 116\nT 50 Mortality tables used in the key countries \u2013\nT 26 Expiry dates of unused tax losses for which\nreporting year 140\nno deferred taxes were recognized 116\nT 51 Mortality tables used in the key countries \u2013\nT 27 Deferred taxes recognized directly in equity 116\nprevious year 141\nT 28 Difference between expected and disclosed\nT 52 Reconciliation of present value of the defined\nincome tax expense 117\nbenefit obligation to the provision 142\nT 29 Personnel expenses 118\nT 53 Development of the net liability of the\nT 30 Headcount 118 defined benefit obligation \u2013 reporting year 143\nT 31 Cash and cash equivalents 118 T 54 Development of the net liability of the\ndefined benefit obligation \u2013 previous year 145\nT 32 Other current and non-current financial assets 119\nT 55 Components of plan assets 147"
        ],
        "response":"The table on total remuneration of management in key positions is on page 186.",
        "reference":"186",
        "faithfulness":1.0,
        "answer_relevancy":0.8644519332,
        "context_precision":1.0,
        "context_recall":1.0
    },
    {
        "user_input":"How many schools participated in the nationwide day of action for democracy and diversity in June 2024?",
        "retrieved_contexts":[
            "and the prestigious ZEIT publishing group, the Stiftung\nBywater heads up the \u201cM.E.T.A. \u2013 Maximizing Effective is helping teachers make democracy a subject in their\nTeaching AI\u201d program. Since September 2024, this train- lessons. More than 100 organizations are supporting this\nthe-trainer program involving Robert Bosch Stiftung and initiative, whose patron is the German Federal President\nStanford University has been instructing teacher-trainers Frank-Walter Steinmeier.\nhow to deal with AI. The Stanford researchers\u2019 focus is on\n4202\ntroper\nlaunnA\nThe Bosch Group Robert Bosch Stiftung Group management report Consolidated financial statements Additional information\n34 The initiative culminates in a nationwide day of action in\nJune 2024, where more than 1,700 schools with over\n300,000 students take a stand for democracy and diversity.\nIn the years ahead, the Stiftung will further extend its\nfunding to promote democracy education for students and\nteachers.\nG 01\nTotal funding 2024",
            "developments, teachers could still choose whether to before they themselves train teachers in the use of AI.\nintegrate them into their classrooms,\u201d says Christine In this way, the Stiftung is helping to initiate meaningful\nBywater, associate director of the Stanford Graduate changes in the education system and to improve the quality\nSchool of Education\u2019s Center to Support Excellence in of teaching.\nTeaching (CSET). But with AI, she says, the situation is\ndifferent. It is already a part of children\u2019s and adolescents\u2019 Teaching democracy in schools\ndaily lives. It is not only structural challenges that schools have to\nreact to. The increasing polarization of society also presents\nteachers with new challenges. And the classroom door is\nno barrier against fake news, hate, and exclusion. Susanne\nGehlen is the principal of the Genoveva high school in\nCologne, Germany. The days following the Hamas attack on\nIsrael in October 2023 are still fresh in her memory. Her",
            ". 2022-748 of 29 April 2022                                    E2023",
            ". 2022-748 of 29 April 2022                                    E2023",
            ". 2022-748 of 29 April 2022                                    E2023"
        ],
        "response":"More than 1,700 schools participated in the nationwide day of action for democracy and diversity in June 2024.",
        "reference":"More than 1,700 schools",
        "faithfulness":1.0,
        "answer_relevancy":1.0,
        "context_precision":0.9999999999,
        "context_recall":1.0
    },
    {
        "user_input":"Who is the chairman of the board of management of the Bosch Group?",
        "retrieved_contexts":[
            "chairman of the supervisory board was regularly informed by\nthe chairman of the board of management about current\ndevelopments and significant events in the company.\nProf. Stefan Asenkerschbaumer\nChairman\n4202\ntroper\nlaunnA\nThe Bosch Group\nSupervisory board report\n16\nRobert Bosch Stiftung Group management report Consolidated financial statements Additional information\nSupervisory board\n17\nProf. Stefan Asenkerschbaumer Dr. Christof Bosch Mario Gutmann\nStuttgart K\u00f6nigsdorf Bamberg\nChairman Spokesperson for the Bosch family Chairman of the works council of the Bamberg\nManaging partner of Robert Bosch Industrie- plant, and member of the central works council\ntreuhand KG, formerly deputy chairman of the of the Mobility business sector as well as\nboard of management of Robert Bosch GmbH Dr. Arne Fischer chairman of the economic committee of the\nMobility business sector\nGemmrigheim\nDirector of strategic projects, Power Solutions\nFrank Sell",
            "Under their new owner, they will have additional opportunities Dr. Stefan Hartung\nfor development. Chairman of the board of management\n4202\ntroper\nlaunnA\nThe Bosch Group\nForeword\nRobert Bosch Stiftung Group management report Consolidated financial statements Additional information\nThe Bosch board of management The Bosch board of management\n10\nDr. Stefan Hartung Dr. Christian Fischer\nChairman of the board Deputy chairman of the board\nof management of management\nDr. Markus Forschner Stefan Grosch\nMember of the board of management Member of the board of management\n4202\ntroper\nlaunnA\nThe Bosch Group\nThe Bosch board of management\nRobert Bosch Stiftung Group management report Consolidated financial statements Additional information\nThe Bosch board of management\n11\nDr. Markus Heyn Dr. Frank Meyer\nMember of the board of management Member of the board of management\nKatja von Raven Dr. Tanja R\u00fcckert\nMember of the board of management Member of the board of management\n4202\ntroper\nlaunnA",
            "Member of the board of management Member of the board of management\nKatja von Raven Dr. Tanja R\u00fcckert\nMember of the board of management Member of the board of management\n4202\ntroper\nlaunnA\nThe Bosch Group\nThe Bosch board of management\nRobert Bosch Stiftung Group management report Consolidated financial statements Additional information\nBoard of management\n12\nDr. Stefan Hartung Dr. Christian Fischer Dr. Markus Forschner\nChairman of the board of management Deputy chairman of the board\nFinance and Performance\nTechnology, Innovation, and Quality of management Industrial Technology business\nsector UNTIL JANUARY 31, 2024\nConsumer Goods business sector\nFunctions and services\nEnergy and Building Technology\n\u2013 Communications and Governmental Affairs Functions and services\n\u2013 Corporate Affairs business sector UNTIL JANUARY 31, 2024 \u2013 Finance, Reporting, and Treasury\n\u2013 Field Quality Board Functions and services \u2013 Global Real Estate",
            "(HSG) and ETH Z\u00fcrich Oberkochen\nChairman of the supervisory board of Karlsruhe\nNadine Boguslawski\nInstitute of Technology and President of\nHattersheim am Main Klaus Friedrich Stifterverband\nChief treasurer of Industriegewerkschaft Metall, W\u00fcrzburg\nFrankfurt am Main Chairman of the works council of Bosch Rexroth AG,\nLohr am Main, and chairman of the central works\ncouncil of Bosch Rexroth AG and member of the\ncombined works council of Robert Bosch GmbH\n4202\ntroper\nlaunnA\nThe Bosch Group\nSupervisory board\nRobert Bosch Stiftung Group management report Consolidated financial statements Additional information\n18 Prof. Renate K\u00f6cher Oliver Simon HONORARY CHAIRMAN OF THE BOSCH GROUP\nKonstanz Dunzweiler\nManaging director, Allensbach Institute Chairman of the works council of the Homburg Prof. Hermann Scholl\nfor Public Opinion Research plant, and member of the central works council\nof the Mobility business sector Stuttgart\nFormerly chairman of the supervisory board",
            "14\nboard of the divisions\nDr. Markus Heyn Claus Fleischer Jan Brockmann\nChairman Bosch eBike Systems Home Comfort\nVolker Schilling Henning von Boxberg Rupert Hoellbacher\nCommercial Bosch Global Service Solutions Mobility Aftermarket\nKlaus M\u00e4der Thomas Quante Michael Budde\nOperations Building Technologies Mobility Electronics\nAndreas Dempf Christoph Hartung Dr. Thomas Pauer\nSales and Customers Cross-Domain Computing Solutions Power Solutions\nDr. Mathias Pillin Steffen Haack Thomas Donato\nTechnology Drive and Control Technology Power Tools\nMarco Zehe Dr. Gerta Marliani\nElectrified Motion Vehicle Motion\n4202\ntroper\nlaunnA\nThe Bosch Group\nThe Bosch board of management\nRobert Bosch Stiftung Group management report Consolidated financial statements Additional information\nSupervisory board\n15\nreport\nLadies and gentlemen,\nIn 2024, despite a difficult business environment, the Bosch\nGroup continued to rigorously orient its strategy to changing"
        ],
        "response":"The chairman of the board of management of the Bosch Group is Dr. Stefan Hartung.",
        "reference":"Dr. Stefan Hartung",
        "faithfulness":1.0,
        "answer_relevancy":1.0,
        "context_precision":0.5833333333,
        "context_recall":1.0
    },
    {
        "user_input":"What is the capital of Austria where several Bosch companies are located?",
        "retrieved_contexts":[
            "Region \/ country Company name Registered office of capital\nEurope\nAustria ITK Engineering GmbH Premst\u00e4tten 100.0\nBelarus Robert Bosch OOO Minsk 100.0\nBulgaria Robert Bosch EOOD Sofia 100.0\nCroatia Robert Bosch d.o.o. Zagreb 100.0\nCzech Republic KR Soft s.r.o. Prague 100.0\nEstonia Robert Bosch O\u00dc Tallinn 100.0\nFrance Soindev 3 (Soci\u00e9t\u00e9 Interm\u00e9diaire de D\u00e9veloppement 3) S.A.S. Saint-Ouen 100.0\nGeorgia Robert Bosch Ltd. Tiflis 100.0\nGreece Bosch Rexroth S.A. Athens 100.0\nItaly Elmo Italy S.R.L. Milan 100.0\nLithuania UAB Robert Bosch Vilnius 100.0\nPoland Elmo Motion Control Poland Sp. z o.o. Warsaw 100.0\nRomania Bosch Servicii Termotehnica S.R.L. Bucharest 100.0\nBSH Electrocasnice Manufacturing S.R.L. Bucharest 100.0\n4202\ntroper\nlaunnA\n210\nThe Bosch Group Robert Bosch Stiftung Group management report Consolidated financial statements Additional information\nList of shareholdings of the Bosch Group\n211\nPercentage share\nRegion \/ country Company name Registered office of capital",
            "companies in some 60 countries. Including sales and service partners,\nBosch\u2019s global manufacturing and sales network covers nearly every\ncountry in the world. The basis for the company\u2019s future growth is its\ninnovative strength. At 120 locations across the globe, Bosch employs\na huge number of associates in research and development.\nThe company was set up in Stuttgart in 1886 by Robert Bosch\n(1861-1942) as \u201cWorkshop for Precision Mechanics and Electrical\nEngineering\u201d. The special ownership structure of Robert Bosch GmbH\nguarantees the entrepreneurial freedom of the Bosch Group, making it\npossible for the company to plan over the long term and to under-\ntake significant up-front investments in the safeguarding of its future.\nNinety-two percent of the share capital of Robert Bosch GmbH is held\nby Robert Bosch Stiftung GmbH, a charitable foundation. The majority\nof voting rights are held by Robert Bosch Industrietreuhand KG, an",
            "1 %\nidated subsidiaries and regional companies in more than Robert Bosch GmbH 5 %\n60 countries. The parent company is Robert Bosch GmbH, ERBO II GmbH \/\nBosch family\nwhich is domiciled in Stuttgart, Germany. It started out as\n\u201cWorkshop for Precision Mechanics and Electrical Engineer-\ning,\u201d founded in Stuttgart in 1886 by Robert Bosch (1861\u2013\n1942). Robert Bosch Stiftung GmbH has been the majority\nshareholder in Robert Bosch GmbH since 1964.\n94 %\nDespite holding roughly 94 percent of the share capital, this\nRobert Bosch\nlimited liability company with a charitable purpose has no Stiftung GmbH\ninfluence on the strategic or business orientation of the\nBosch Group. A further roughly 5 percent of the share capital\nis held by the not-for-profit ERBO II GmbH, established by G 03\nthe founder\u2019s descendants, and some 1 percent by Robert Shareholders of Robert Bosch GmbH\nBosch GmbH itself. Of the voting rights, some 93 percent are Voting rights",
            "susteco solutions GmbH Berlin 100.0\nWeWash GmbH Munich 100.01\nWOGE Service- und Regiebetrieb GmbH Stuttgart 100.01\n1. These companies make use of the exemption provided for in Sec. 264 (3) HGB.\n2. These companies make use of the exemption provided for in Sec. 291 (2) HGB.\n3. This company makes use of the exemption provided for in Sec. 264b HGB.\n4202\ntroper\nlaunnA\n190\nThe Bosch Group Robert Bosch Stiftung Group management report Consolidated financial statements Additional information\nList of shareholdings of the Bosch Group\n191\nPercentage share\nRegion \/ country Company name Registered office of capital\nEurope\nAustria Bosch General Aviation Technology GmbH Vienna 100.0\nBosch Industriekessel Austria GmbH Bischofshofen 100.0\nBosch Rexroth GmbH Pasching 100.0\nBSH Finance and Holding GmbH Vienna 100.0\nBSH Hausger\u00e4te Gesellschaft mbH Vienna 100.0\nMIIT Mechatronics Industries GmbH Vienna 100.0\nRobert Bosch AG Vienna 100.0\nRobert Bosch Holding Austria GmbH Vienna 100.0",
            "49,600 metric tons of CO\u2082, or 8.5 percent.3 significant up-front investments in the safeguarding of its\nfuture. 94 percent of the share capital of Robert Bosch\nThe Bosch Group comprises Robert Bosch GmbH and its GmbH is held by Robert Bosch Stiftung GmbH, a charitable\nroughly 490 subsidiary and regional companies in more foundation. The remaining shares are held by Robert Bosch\nthan 60 countries. Including sales and service partners, GmbH and by a corporation owned by the Bosch family. The\nBosch\u2019s global manufacturing, engineering, and sales net- majority of voting rights are held by Robert Bosch Industrie-\nwork covers nearly every country in the world. Bosch\u2019s in- treuhand KG. Further information on the organization of the\nnovative strength is key to the company\u2019s further develop- Bosch Group, the activities of the business sectors, and the\nment. Bosch employs around 86,800 associates in research company\u2019s economic situation, can be found in the current"
        ],
        "response":"The capital of Austria where several Bosch companies are located is Vienna.",
        "reference":"Vienna",
        "faithfulness":0.5,
        "answer_relevancy":1.0,
        "context_precision":0.25,
        "context_recall":1.0
    },
    {
        "user_input":"What was the EBIT of the Industrial Technology business sector in millions of euros?",
        "retrieved_contexts":[
            "a result of additional structural measures that were an- 704 million euros, EBIT from operations was therefore also\nnounced over the course of the year and that were not in- less than the previous year\u2019s 896 million e uros. EBIT margin\ncluded in our expectations. from operations fell to 3.5 percent, compared with 4.5 per-\ncent in the previous year. In our forecasts, we had assumed a\nThe Industrial Technology business sector discloses EBIT of significant improvement. The determining factor here is ad-\n78 million e uros and a margin of 1.2 percent. In our forecast, ditional structural adjustments. There were also burdens\nwe had already assumed a significant drop in result. Espe- from weak market developments and increased demand for\ncially in mobile hydraulics, market developments were even more affordable products. Improvements on the cost side\nmore difficult than expected. The steep drop in sales r evenue were only partly able to offset these two effects.",
            "Industrial Technology business sector was hit particularly hard by market developments.\nFor 2024, the Bosch Group discloses an EBIT margin from operations of 3.5 percent. This\ncontrasts with our forecast of roughly 5 percent, more or less on a par with the previous\nyear. In addition to lower sales revenue and the idle capacity that goes with it, this is also\ndue to necessary additional structural adjustments. Despite some considerable declines\nin sales revenue, all business sectors disclose positive EBIT from operations, but EBIT\nmargin is below both expectations and the previous year. At 0.9 billion euros, Bosch Group\nfree cash flow is positive despite the decline in EBIT, and meets the expectation formu-\nlated in the previous year. For the internal KPI of average NWC, only Consumer Goods and\nEnergy and Building Technology met our expectations of a significant decline across all\nbusiness sectors.\n4202\ntroper\nlaunnA\nGroup management report\nReport on economic position\n59",
            "Result from companies included at equity 3 6\nEarnings before interest and taxes (EBIT) 2,796 4,503\nFinancial result \u201368 \u2013527\nProfit before tax 2,728 3,976\nIncome tax expenses \u20131,396 \u20131,336\nProfit after tax 1,332 2,640\nThe Energy and Building Technology business sector re- attributable to the Mobility business sector rose to 61.8 per-\nported a nominal decrease in sales revenue of 2.7 percent to cent, and was thus higher than the previous year\u2019s 61.3 per-\n7.5 billion euros, compared with the previous-year figure of cent. The share of Industrial Technology fell to 7.1 percent,\n7.7 billion euros. Adjusted for exchange-rate effects, sales following the previous-year figure of 8.1 percent. The Con-\nrevenue fell 2.6 percent. The expected 2 to 4 percent growth sumer Goods business sector\u2019s share rose to 22.4 percent.\nin sales revenue was not achieved, therefore. The decline in The comparable previous-year share, without other activities,",
            "ences in our business sectors\u2019 fortunes mean that our sales EBIT from operations comes to 3.1 billion euros, following\nrevenue structure has changed. The share of sales revenue the previous-year figure of 4.8 billion euros. Unlike the EBIT\n4202\ntroper\nlaunnA\nGroup management report\nReport on economic position\n66\nThe Bosch Group Robert Bosch Stiftung Consolidated financial statements Additional information\nG 11 G 12\nResearch and development cost, Research and development cost,\n2020 \u2013 2024 2020 \u2013 2024\nin millions of e uros as a percentage of sales revenue\n7,807 8.6\n7,224 7,331 8.2 7.8 8.2 8.0\n5,890 6,110\n2020 2021 2022 2023 2024 2020 2021 2022 2023 2024\ndisclosed in the income statement, and as in previous years, tribution margin needed to cover structural costs is insuffi-\nthe calculation of the result from operations disregards the cient. Instead of a 1.4 percent drop in sales, we had assumed",
            "consumer goods markets. situation in the construction industry remains unsatisfactory\nacross the globe. Against this backdrop, the business sector\nAt 6.4 billion euros, sales revenue in the Industrial Technol- was able to increase its overall sales revenue by a nominal\nogy business sector was significantly below the previous 1.6 percent to 20.3 billion euros, from the previous year\u2019s fig-\nyear\u2019s figure of EUR 7.4 billion. This corresponds to a nominal ure of 19.9 billion euros. Adjusted for exchange-rate effects,\ndecline of 13.0 percent, or 12.5 percent after adjusting for sales revenue increased by 2.9 percent and was thus only\nexchange-rate effects. A key role in this was played by the slightly below the forecast range of 3 to 5 percent. Looked\nsteeper than expected decline in the construction and at by division, sales revenue at BSH Hausger\u00e4te developed\nmachinery sectors in the main markets of Europe, North better than at Power Tools."
        ],
        "response":"The EBIT of the Industrial Technology business sector was 78 million euros.",
        "reference":"78 million euros",
        "faithfulness":1.0,
        "answer_relevancy":0.9422485167,
        "context_precision":0.9999999999,
        "context_recall":1.0
    },
    {
        "user_input":"What is the page number for the consolidated statement of financial position?",
        "retrieved_contexts":[
            "Consolidated statement of financial position\n91\nfor the year ended December 31, 2024\nT 05\nAssets\nin millions of euros\nNote 12\/31\/2024 12\/31\/2023\nCurrent assets\nCash and cash equivalents 14 8,223 7,443\nTrade receivables 15 17,536 17,081\nOther financial assets 16 7,777 7,822\nContract assets 17 1,167 1,176\nIncome tax receivables 350 379\nOther assets 18 2,610 2,628\nInventories 19 15,674 15,184\n53,337 51,713\nNon-current assets\nFinancial assets 16 14,899 14,538\nContract assets 17 811 695\nIncome tax receivables 258 205\nProperty, plant, and equipment 20 25,939 24,616\nRight-of-use assets 32 2,710 2,276\nIntangible assets 21 10,552 11,055\nInvestments measured at equity 6 76 53\nOther assets 18 1,188 1,008\nDeferred taxes 12 2,189 2,017\n58,622 56,463\nAssets held for sale 6 807 154\nTotal assets 112,766 108,330\nCONTINUED NEXT PAGE\n4202\ntroper\nlaunnA\nConsolidated financial statements\nConsolidated statement of financial position\n91",
            "Consolidated financial statements 87\nof Robert Bosch GmbH\nas of December 31, 2024\n4202\ntroper\nlaunnA\nConsolidated financial statements\nThe Bosch Group Robert Bosch Stiftung Group management report Consolidated financial statements Additional information\n88 89 Consolidated income statement 118 Notes to the statement of financial position\n118 14 \u2014 Cash and cash equivalents\n90 Consolidated statement 118 15 \u2014 Trade receivables\nof comprehensive income 119 16 \u2014 Other current and non-current financial assets\n120 17 \u2014 Contract assets\n121 18 \u2014 Other current and non-current assets\n91 Consolidated statement\n121 19 \u2014 Inventories\nof financial position\n122 20 \u2014 Property, plant, and equipment\n125 21 \u2014 Intangible assets\n93 Consolidated statement\n131 22 \u2014 Trade payables\nof changes in equity\n132 23 \u2014 Other current and non-current financial liabilities\n133 24 \u2014 Contract liabilities\n94 Consolidated statement 134 25 \u2014 Other liabilities, other provisions, contingent",
            "4202\ntroper\nlaunnA\n149\nThe Bosch Group Robert Bosch Stiftung Group management report Consolidated financial statements Additional information\nNotes to the consolidated financial statements\nOther notes 150 Financing activities combine the cash inflows and outflows\nfrom borrowing and repayment of financial liabilities, from\n28 \u2014 Statement of cash flows the repayment of lease liabilities, and from dividends.\nThe statement of cash flows presents cash inflows and\noutflows from operating activities, investing activities, and Changes in items of the statement of financial position con-\nfinancing activities. tained in the statement of cash flows cannot be directly\nderived from the statement of financial position, as they have\nCash flows are derived indirectly, starting from EBIT. EBIT is been adjusted for exchange-rate effects and changes in the\nearnings before the financial result and before tax. Cash consolidated group.\nflows from operating activities are adjusted for non-cash",
            "troper\nlaunnA\nThe Bosch Group Robert Bosch Stiftung Group management report Consolidated financial statements Additional information\n225 4202\ntroper\nlaunnA\nThe Bosch Group Robert Bosch Stiftung Group management report Consolidated financial statements\nList of graphs and tables\n222266\nList of graphs List of tables\nNo. Name Page\nNo. Name Page\nG 01 Funding 2024 34\nT 01 Most important items of the income statement 66\nG 02 Shareholders of Robert Bosch GmbH \u2013\nT 02 Consolidated statement of cash flows 73\nShareholding 39\nT 03 Consolidated income statement 89\nG 03 Shareholders of Robert Bosch GmbH \u2013\nVoting rights 39 T 04 Consolidated statement of comprehensive\nincome 90\nG 04 Business sectors and divisions,\nother businesses 41 T 05 Consolidated statement of financial position 91\nG 05 Sales revenue, 2020\u20132024 T 06 Consolidated statement of changes in equity 93\n(in millions of euros) 60\nT 07 Consolidated statement of cash flows 94\nG 06 EBIT, 2020\u20132024 (in millions of euros) 60",
            "audit,\nTo Robert Bosch Gesellschaft mit beschr\u00e4nkter Haftung\n\u2015 the accompanying consolidated financial statements\nOpinions comply, in all material respects, with the IFRS Account-\nWe have audited the consolidated financial statements of ing Standards as issued by the International Accounting\nRobert Bosch Gesellschaft mit beschr\u00e4nkter Haftung, Stutt- Standards Board (IASB) (IFRS Accounting Standards)\ngart and its subsidiaries (the Group), which comprise the and adopted by the EU, and the additional requirements\nconsolidated income statement and consolidated statement of German commercial law pursuant to Sec. 315e (1)\nof comprehensive income for the fiscal year from January 1 HGB and, in compliance with these requirements, give\nto December 31, 2024, the consolidated statement of finan- a true and fair view of the assets, liabilities and financial\ncial position as at December 31, 2024, the consolidated position of the Group as at December 31, 2024, and of"
        ],
        "response":"The page number for the consolidated statement of financial position is 91.",
        "reference":"70",
        "faithfulness":1.0,
        "answer_relevancy":1.0,
        "context_precision":0.0,
        "context_recall":0.0
    },
    {
        "user_input":"What is the target annual rate of sales growth set for the Mobility business sector until 2030?",
        "retrieved_contexts":[
            "able amount is below the carrying amount of the net assets term growth rate.\nof a cash-generating unit (including the goodwill allocated\nto it). An asset\u2019s recoverable amount is the higher of its fair An annual rate of sales growth of 5 percent has been set as\nvalue less costs of disposal and its value in use. The recover- a target in the Mobility business sector for the period until\nable amount for all cash-generating units is determined 2030. The growth target was reduced by one percentage\nbased on fair value less costs to sell, which is derived from point year on year to account for both the adjusted expecta-\nthe future cash flows. Fair value is largely determined by the tions regarding global vehicle production and the expected\npresent value of the perpetual annuity, which in turn is in- delay in the onset of technologies of future importance relat-\nfluenced above all by the applicable discount rate and the ing in particular to electromobility, automated driving, new",
            "our aim is to serve those needs with customized technolo- new providers and competitors from other industries, such\ngies and solutions from a single source. This is why one of as software and semiconductors.\nour strategic focal points for 2024 was the realignment of\nthe Mobility business sector as an integrated business sec- In the Mobility business sector, our target is to achieve aver-\ntor with its own management team and P&L responsibility age annual sales revenue growth of 5 percent by 2030. In\nacross its business areas. The business sector is organized other words, we have lowered our growth target by around\nalong horizontal and vertical domains in order to simplify 1 percentage point due to the growth expectations for global\ncollaboration in areas such as electrification, vehicle dynam- vehicle production. We have also taken into account the\nics, driver assistance systems, vehicle computers, and soft- ex pected shifts in future technologies. Nonetheless, we",
            "company. We want this aspiration to be reflected in our tended sale of the Building Technologies division\u2019s product\nfinancial targets as well. With regard to sales, our aim is aver- business for security and communication technology (Energy\nage annual growth of 6 to 8 percent between now and 2030, and Building Technology business sector) to funds advised\ngiven normal inflation rates of 2 to 3 percent. In this context, by Triton Investments Advisers LLP, United Kingdom.\nwe take our lead from the European Central Bank\u2019s medium-\n4202\ntroper\nlaunnA\nGroup management report\nProspects for the Bosch Group\n46\nThe Bosch Group Robert Bosch Stiftung Consolidated financial statements Additional information\nAmple opportunities Electrification is of particular importance for Mobility, our\nFor the Bosch Group, there are considerable growth oppor- biggest business sector. Despite regional differences in the",
            "Sales revenue by business sector G 10\nAll business sectors felt the effects of weak developments Sales revenue by business sector, 2024\nin their core markets, albeit to varying degrees. The business percentage figures\nsectors did not reach the forecasts for sales revenue growth.\n8.3 %\nEnergy and Building Technology\nIn light of the global decline in vehicle production, sales rev- 7.1 %\nenue in the Mobility business sector was 55.8 billion euros, Industrial\nTechnology\nand thus a nominal 0.7 percent below the previous year\u2019s\n56.2 billion euros. Adjusted for exchange-rate effects, sales\nrevenue grew 0.2 percent. The business sector thus fell\n90.3\nsignificantly short of its forecast growth corridor of 7 to 22.4 % billion euros\n9 percent. One main reason for this was weak market de- Consumer\nGoods 61.8 %\nvelopments, especially in Europe. This region accounts for Mobility\n42 percent of our sales revenue. In addition, sales revenue\n0.4 %",
            "Goods 61.8 %\nvelopments, especially in Europe. This region accounts for Mobility\n42 percent of our sales revenue. In addition, sales revenue\n0.4 %\ngrowth in areas of future importance such as electromobility Other activities\nand automated driving fell significantly short of our own\nplans. This also applies in particular to the European mar-\nket, where demand for these technologies is developing In the Consumer Goods business sector, demand appears\nmore slowly than expected. Moreover, our forecasts for the to be stabilizing after the sharp slump that followed the\nAmericas were not met, also in the market for trucks. The coronavirus pandemic-related boom. For example, retail\ne-bike business felt the effects of persistent weakness in the sales picked up again over the course of 2024. However, the\nconsumer goods markets. situation in the construction industry remains unsatisfactory\nacross the globe. Against this backdrop, the business sector"
        ],
        "response":"The target annual rate of sales growth set for the Mobility business sector until 2030 is 5 percent.",
        "reference":"5 percent",
        "faithfulness":1.0,
        "answer_relevancy":0.991707467,
        "context_precision":1.0,
        "context_recall":1.0
    },
    {
        "user_input":"What was the percentage increase in research and development cost compared to the previous year?",
        "retrieved_contexts":[
            "reversal of provisions. due to greater burdens from structural adjustments that it\nwas not possible to offset. In the research and development\nThe effects that play a major role in the picture for result \u2013 cost, there were no appreciable changes in the share of cap-\nvolume of sales revenue, changes in the product mix, and italized development cost. The ratio of distribution cost and\nadditional structural measures \u2013 have negative repercus- administrative expenses to sales revenue is thus 20.5 per-\nsions for the functional cost items in the income statement. cent, compared with the previous year\u2019s 19.9 percent, and\nPersonnel expenses rose 9.8 percent to 29.5 billion euros. the research and development cost ratio 8.6 percent, com-\nThe ratio of personnel expenses to sales revenue thus in- pared with the previous year\u2019s figure of 8.0 percent. There\ncreased to 32.6 percent, from 29.3 percent the previous were no major changes in other operating income and ex-",
            "creased to 32.6 percent, from 29.3 percent the previous were no major changes in other operating income and ex-\nyear. Depreciation of property, plant, and equipment rose penses. As in the previous year, the positive balance results\n9.2 percent to 3.7 billion euros. These factors mean that especially from earnings from the reversal of provisions.\nEBIT (earnings before interest and taxes) disclosed in the\nincome statement fell significantly to 2.8 billion euros, from The Mobility business sector again accounted for the largest\nthe previous-year figure of 4.5 billion euros. It was not possi- share of research and development cost in 2024, at 74 per-\nble to offset them through the additional measures on the cent (previous year: 72 percent). The main focus of these up-\ncost and price side. front investments continues to be electrification, fuel cells,\nand driver assistance systems \u2013 also with a view to auto-",
            "ences in our business sectors\u2019 fortunes mean that our sales EBIT from operations comes to 3.1 billion euros, following\nrevenue structure has changed. The share of sales revenue the previous-year figure of 4.8 billion euros. Unlike the EBIT\n4202\ntroper\nlaunnA\nGroup management report\nReport on economic position\n66\nThe Bosch Group Robert Bosch Stiftung Consolidated financial statements Additional information\nG 11 G 12\nResearch and development cost, Research and development cost,\n2020 \u2013 2024 2020 \u2013 2024\nin millions of e uros as a percentage of sales revenue\n7,807 8.6\n7,224 7,331 8.2 7.8 8.2 8.0\n5,890 6,110\n2020 2021 2022 2023 2024 2020 2021 2022 2023 2024\ndisclosed in the income statement, and as in previous years, tribution margin needed to cover structural costs is insuffi-\nthe calculation of the result from operations disregards the cient. Instead of a 1.4 percent drop in sales, we had assumed",
            "tion from forecast. Due to volumes that were considerably nel expenses and price increases, even if the cost of raw\nlower than expected and shifts in the product mix, the con- materials fell. A greater number of measures on both the\n4202\ntroper\nlaunnA\nGroup management report\nReport on economic position\n67\nThe Bosch Group Robert Bosch Stiftung Consolidated financial statements Additional information\ncost and price side were not able to offset these burdening At 18.5 billion euros, distribution cost and administrative ex-\nfactors. Year on year, moreover, a number of special effects penses were 1.6 percent higher than in the previous year. Re-\nhad negative repercussions. As in the previous year, there search and development cost rose 6.5 percent to 7.8 billion\nare similarly positive effects on result resulting from the euros. In the case of both items, this increase is especially\nreversal of provisions. due to greater burdens from structural adjustments that it",
            "tion of property, plant, and equipment is also an important business sector was 5 percent, following 6 percent in the\nfactor for the cost of sales. Running counter to this, the cost previous year.\nof materials fell at a faster rate than sales revenue. Cost of\nmaterials decreased 2.1 percent to 42.9 billion e uros. The On balance, we disclose a negative financial result of 68 mil-\nratio of cost of sales to sales revenue thus fell to 47.5 per- lion euros in 2024, which is a significant improvement from\ncent, compared with 47.9 percent the previous year. Despite the previous year\u2019s negative balance of 527 million euros.\nmany measures to improve competitiveness, including lower The main factors here are the increase in the value of securi-\nraw materials costs, the gross margin fell 0.5 points. ties and gains from derivatives in foreign-currency hedging\n4202\ntroper\nlaunnA\nGroup management report\nReport on economic position\n68"
        ],
        "response":"The research and development cost rose 6.5 percent to 7.8 billion euros compared to the previous year.",
        "reference":"6.5 percent",
        "faithfulness":1.0,
        "answer_relevancy":0.8884058793,
        "context_precision":0.5,
        "context_recall":1.0
    },
    {
        "user_input":"What was the total sales revenue for the Bosch Group in 2024?",
        "retrieved_contexts":[
            "following the extraordinary boom during the peak phase of 27.9 28.0\nthe coronavirus pandemic appears to be coming to an end.\n16.9 17.8\nBusiness developments\nDevelopment of sales 2023 2024 2023 2024 2023 2024\nBosch Group sales revenue Europe Americas Asia Pacific 1\nIn the Bosch Group, we achieved sales revenue of 90.3 bil-\nlion euros in 2024, compared with 91.6 billion euros in the 1. Including other countries and Africa.\nprevious year. Year on year, sales revenue fell a nominal\nG 08\n1.4 percent, or 0.5 percent after adjusting for exchange-rate\nSales revenue by region, 2024\neffects. The development of sales revenue thus fell signifi-\npercentage figures\ncantly short of the 5 to 7 percent growth forecast for 2024.\nHere, the pivotal factor was the weakness of our core mar-\nkets, which developed more weakly than global economic\noutput as a whole. The total negative impact of exchange- 31.0 %\nrate effects on sales revenue is some 0.8 billion euros. These Asia Pacific 1",
            "especially challenging in the mechanical engineering market and the construction industry.\nAgainst this backdrop, it was not possible to realize our sales revenue and earnings\nexpectations for 2024, which cannot be satisfactory for us. Sales revenue of the Bosch\nGroup declined by 1.4 percent to 90.3 billion euros in nominal terms and by 0.5 percent\nafter adjusting for exchange-rate effects. EBIT margin from operations comes to 3.5 per-\ncent, compared with 5.3 percent in the previous year. This decline was driven not only by\nmarket developments but also by additional structural measures. These measures, taken\nin light of the difficult business environment over the course of 2024, initially have a nega-\ntive impact on result. The business sectors were affected to varying degrees. With the\nexception of Consumer Goods, all business sectors had to cope with declining sales\nrevenue. However, all business sectors disclose a positive result for 2024.\n4202\ntroper\nlaunnA\nGroup management report",
            "manner, we want to improve people\u2019s quality of life and safeguard the\nlivelihoods of present and future generations.\nBosch Group profile\nG 01\nThe Bosch Group is a leading global supplier of technology\nand services. It employs roughly 417,900 associates world- Sales revenue\nwide (as of December 31, 2024). The company generated Bosch Group 2024 by region, in billions of euros\nsales revenue of 90.3 billion euros in 2024. Its operations\nare divided into four business sectors: Mobility, Industrial\nAsia Pacific Europe\nTechnology, Consumer Goods, and Energy and Building (including other 44.5\ncountries, also\nTechnology. Universal trends such as automation, electrifi- in Africa) 90.3\ncation, digitalization, and connectivity as well as an orien- 28.0\nAmericas\ntation to sustainability are increasingly determining the\n17.8\ngroup\u2019s business operations. Bosch\u2019s broad footprint as a\nglobal and diversified technology company strengthens its\ninnovativeness and robustness.\nG 02",
            "For the Bosch Group, it proved impossible to sidestep the difficult market situation in its\nmain areas of business and the weak global economy. The year 2024 was an outlier, with\nall our core markets underperforming at the same time. This particularly affected business\nin Europe. Against this backdrop, Bosch Group sales revenue and result are down on the\nprevious year. We cannot be satisfied with this. Our expectations for 2024 were therefore\nnot fulfilled. Sales revenue declined by 1.4 percent to 90.3 billion e uros in nominal terms\nand by 0.5 percent after adjusting for exchange-rate effects. Market developments affected\nall our business sectors. With the exception of the Consumer Goods business sector,\nsales revenue is down year on year, and below expectations in all business sectors. The\nIndustrial Technology business sector was hit particularly hard by market developments.\nFor 2024, the Bosch Group discloses an EBIT margin from operations of 3.5 percent. This",
            "revenue. However, all business sectors disclose a positive result for 2024.\n4202\ntroper\nlaunnA\nGroup management report\n37\nThe Bosch Group Robert Bosch Stiftung Consolidated financial statements Additional information\nThe 2025 fiscal year will also be challenging, partly due to the uncertainties in global\ntrade and economic relations. The aim is to grow Bosch Group sales revenue in the range\nof at least 1 to 3 percent and to improve the margin from operations. Our forecasts do\nnot yet include the effects of the portfolio changes resulting from the planned acquisition\nin the heating, ventilation, and air-conditioning business and from the divestment of\nmajor parts of the Building Technologies division\u2019s product business. These transactions\nare expected to be completed in the course of 2025, subject to the necessary regulatory\napprovals. Extensive measures will also help increase competitiveness in 2025. Some"
        ],
        "response":"The total sales revenue for the Bosch Group in 2024 was 90.3 billion euros.",
        "reference":"90.3 billion euros",
        "faithfulness":1.0,
        "answer_relevancy":1.0,
        "context_precision":1.0,
        "context_recall":1.0
    },
    {
        "user_input":"What is the liability amount of Robert Bosch GmbH to Robert Bosch Stiftung GmbH as of the reporting date?",
        "retrieved_contexts":[
            "Group as lessors stem mainly from activities of the Building is the sole shareholder of Bosch Pensionsfonds AG. In the\nTechnologies and BSH Hausger\u00e4te GmbH divisions. They are fiscal year, contributions were made to the plan assets of\ndue as follows in the reporting year: Bosch Pensionsfonds AG to finance pension obligations. For\nfurther details, see note 26 \u201cProvisions for pensions and\nT 88\nsimilar obligations.\u201d\nin millions of euros\nRobert Bosch Stiftung GmbH, Stuttgart, is the lessee of sev-\n2024 2023\neral properties belonging to Robert Bosch GmbH, Stuttgart.\nWithin one year 61 51\nAs of the reporting date, furthermore, Robert Bosch GmbH\nLater than one year\nand no later than two years 4 9 has a liability of EUR 36 million (previous year: EUR 47 mil-\nlion) to Robert Bosch Stiftung GmbH.\nLater than two years\nand no later than three years 3 3\nLater than three years\nand no later than four years 3 2\nLater than four years\nand no later than five years 2 2\nLater than five years 1 2\n74 69",
            "guarding of its future. Ninety-four percent of the share capital of Robert Bosch\nGmbH is held by Robert Bosch Stiftung GmbH, a limited liability company with\na charitable purpose. The remaining shares are held by Robert Bosch GmbH\nand by a corporation owned by the Bosch family. The majority of voting rights\nare held by Robert Bosch Industrietreuhand KG.\nFor press inquiries, contact the corporate department Communications and Govern- Robert Bosch GmbH\nmental Affairs, Bosch Media Service: bosch-press.com Postfach 10 60 50\n70049 Stuttgart, Germany\nFor information on career opportunities in the Bosch Group, contact the corporate\nPhone +49 711 811-0\ndepartment Human Resources at bosch.com\/careers\ncontact@bosch.com\nCompanies wishing to become suppliers to Bosch should contact the corporate bosch.com\nsector Global Business Services at purchasing.bosch.com\nThe 2024 annual report is available online and as a downloadable PDF at\nannual-report.bosch.com\n | \n | Follow us on",
            "Industrie treuhand KG, Stuttgart (0.01 percent of the shares), Company Register [Unternehmensregister] and published there.\nwhich performs the entrepreneurial ownership functions.\nRobert Bosch GmbH holds treasury stock equivalent to 2 \u2014 Changes in financial reporting\n0.64 percent of capital. For further information on the Bosch\nGroup\u2019s business activities, please refer to note 29 \u201cSeg- Accounting standards applied for the first time\nment reporting\u201d and to the group management report. in the fiscal year 2024\nThe following new or revised standards became effective for\nThe consolidated financial statements of Robert Bosch the first time in the reporting year:\nGmbH as of December 31, 2024, have been prepared in\naccordance with the International Financial Reporting Stan- \u2013 Amendments to IAS 1 Presentation of Financial State-\ndards (IFRSs) as adopted by the EU at the end of the report- ments (Classification of Liabilities as Current or Non-",
            "due later than four years\nand no later than five years 20 20\ndue later than five years 46 44\n188 185\nUnearned finance income 16 17\nIn relation to finance leases, finance income in the reporting\nyear came to EUR 5 million (previous year: EUR 6 million)\n4202\ntroper\nlaunnA\n184\nThe Bosch Group Robert Bosch Stiftung Group management report Consolidated financial statements Additional information\nNotes to the consolidated financial statements\n185 and losses on disposal amounted to EUR 2 million (previous 33 \u2014 Related party disclosures\nyear: EUR 3 million). There were no unguaranteed residual As shareholder, Robert Bosch Industrietreuhand KG exer-\nvalues. cises the majority of voting rights at Robert Bosch GmbH. In\naddition, Robert Bosch Industrietreuhand KG is responsible\nUnder operating leases, the lessor retains substantially all for the internal audit of the Bosch Group. The related costs",
            "ERBO II GmbH Bosch family\nBosch family\n94%\nRobert Bosch\nStiftung GmbH 93%\nRobert Bosch\nI ndustriet reuhand KG\nThe company was set up in Stuttgart in 1886 by Robert Bosch (1861\u20131942) as\n\u201cWorkshop for Precision Mechanics and Electrical Engineering.\u201d The special\n1886\nownership structure of Robert Bosch GmbH guarantees the entrepreneurial\nfreedom of the Bosch Group, making it possible for the company to plan over\nthe long term and to undertake significant upfront investments in the safe-\nguarding of its future. Ninety-four percent of the share capital of Robert Bosch\nGmbH is held by Robert Bosch Stiftung GmbH, a limited liability company with\na charitable purpose. The remaining shares are held by Robert Bosch GmbH\nand by a corporation owned by the Bosch family. The majority of voting rights\nare held by Robert Bosch Industrietreuhand KG.\nFor press inquiries, contact the corporate department Communications and Govern- Robert Bosch GmbH"
        ],
        "response":"The liability amount of Robert Bosch GmbH to Robert Bosch Stiftung GmbH as of the reporting date is EUR 36 million.",
        "reference":"EUR 36 million",
        "faithfulness":1.0,
        "answer_relevancy":1.0,
        "context_precision":0.9999999999,
        "context_recall":1.0
    },
    {
        "user_input":"What was the Bosch Vocational Centre (BVC) previously known as before its renaming in 2008?",
        "retrieved_contexts":[
            "which became one of the best establishments of its\nthe Federal Ministry for Economic Cooperation and\nkind in India.\nDevelopment, Germany. MVC was renamed to Bosch\nMVC was so ahead of its time that the government of Vocational Centre (BVC) in 2008. By 2014, it had won\nIndia used it as a model and consulted the company 216 gold medals (Best Trade Apprentices) for best\nwhen enacting the Apprentices Act in 1961. The performance in the All-India Competitions held by the\nCentre expanded and introduced a number of courses Directorate General of Employment and Training (DGET),",
            "Above: The Bosch software facility at Coimbatore also houses a state-of- headquartered at Coimbatore.\nthe-art EMC (Electromagnetic Compatibility) lab for enhancing quality and\nreliability of automotive components, and an ECU Reliability Testing Centre\nwhich conducts tests for optimum performance of ECUs.\n55 | \nNone | \n\u201cIn future, all the subsidiaries in India will bear the Bosch name. As much as we are keen\nto promote awareness of the Bosch name in India, Mico remains a valuable brand for us.\nIt is so well-established in the local market that we will continue to use it, particularly for\nour well-established products for the automotive aftermarket\u201d.\n- Bernd Bohr, in an announcement in 2008 when Mico was renamed to Bosch Limited.\n56\n2008 onwards\nA new identity, new\nsubsidiaries for emerging\nmarkets, increased research\nactivities, new regional\nsubsidiary at Bangladesh",
            "Bosch in India, unveiled the renaming of Mico to Bosch Limited in February 2008.\n57\n2008 onwards\nA new identity, new\nsubsidiaries for emerging\nmarkets, increased research\nactivities, new regional\nsubsidiary at Bangladesh\n(cid:48)(cid:44)(cid:38)(cid:50)(cid:3)(cid:69)(cid:72)(cid:70)(cid:82)(cid:80)(cid:72)(cid:86)(cid:3)(cid:37)(cid:50)(cid:54)(cid:38)(cid:43)\nFebruary 1, 2008, is a historical milestone in the company\u2019s annals. Motor",
            "was renamed as Bosch Limited. Also the software arm, Robert Bosch\nIndia Limited, was renamed Robert Bosch Engineering and Business\nSolutions Limited.\nThis new identity marked the transformation of the company as well as the\nbrand. The journey towards this new identity hadn\u2019t been easy. It involved\nover 10,000 associates in a multicultural set-up and geographically diverse\ncustomer segments.\nExcept in the automotive aftermarket business which would use the brand\nMICO and dual branding MICO BOSCH for strategic reasons, all other\nbusinesses and products were consolidated under the BOSCH brand. Bosch\nbecame known in its truest sense as a global leader with technological\nsuperiority in India. Bosch was indeed the forerunner of innovative products\nnot just in automotive, but also in power tools, packaging and security\ntechnologies.",
            "occupational health and safety. The 11 principles are Mutual Gain Negotiations\nBLC is envisioned as a Collaboration, Innovation, and\nbased on the core labor standards of the International\nLeadership center for all Boschlers and would facilitate World-class infrastructure for inspired learning Bosch accepts to have Trade Unionism and collective\nLabor Organization (ILO). The Company\u2019s executives\nthe \u2018One Bosch\u2019 brand experience ecosystem. It will \u25cf 4.5 acre campus with 1.7 acre of landscaping receive training to help them comply with these bargaining, and this is a fundamental human right laid down\nserve as a hub for reskilling, upskilling, and focusing in the Indian constitution and directive principles of the State.\n\u25cf State-of-the-art, holistic learning center principles. The principles are available in more than\non prospective leadership and technical and digital Bosch believes in mutual gain. It has always encouraged"
        ],
        "response":"The Bosch Vocational Centre (BVC) was previously known as the Bosch MVC.",
        "reference":"MVC",
        "faithfulness":1.0,
        "answer_relevancy":0.8954957288,
        "context_precision":0.9999999999,
        "context_recall":1.0
    },
    {
        "user_input":"What does the Two-Wheeler and Powersports business unit's portfolio include?",
        "retrieved_contexts":[
            "units and sensors for impact detection as well as vehicle solutions for diagnostics and cybersecurity.\ndynamics sensors.\n4202\ntroper\nlaunnA\nGroup management report\nFundamental information about the group\n43\nThe Bosch Group Robert Bosch Stiftung Consolidated financial statements Additional information\nThe Two-Wheeler and Powersports business unit\u2019s port- bits, and saw blades). These are marketed not only under the\nfolio includes safety and assistance systems, displays, con- Bosch brand but also under the Diablo, sia abrasives, and\nnectivity functions, control units, and components for both Freud brands. Precision rotary tools for DIY applications are\ncombustion engines and electric motors for two-wheelers, also sold under the Dremel brand.\nthree-wheelers, and powersports vehicles.\nBSH Hausger\u00e4te\nIndustrial Technology business sector The BSH Hausger\u00e4te product portfolio ranges from wash-",
            "portfolio also includes control units, software, and services systems) business). The Compute portfolio includes solu-\nfor all powertrain types as well as for hydrogen and thermal tions for the integration of entertainment, navigation, tele-\nsystems. Power Solutions also develops engine control units matics, and driver assistance functions. There are also solu-\nand exhaust-gas treatment solutions. tions for cross-domain and centralized electric\/electronic\narchitectures. The ADAS portfolio includes functions for\nVehicle Motion visualizing the vehicle\u2019s surroundings as well as assistance\nThe Vehicle Motion division develops and produces steering systems. In addition, it develops sensors with an integrated\nand braking systems, sensors, software-based and cross- control unit and embedded software as well as pure hard-\ndomain vehicle dynamics control systems, service solutions, ware sensors for indoor and outdoor use such as camera,",
            "Robert Bosch Stiftung Group management report Consolidated financial statements Additional information\nBusiness sectors\n20\nIndustrial Technology Consumer Goods\n\u2013 Drive and Control Technology 1 \u2013 Power Tools\n\u2013 BSH Hausger\u00e4te GmbH\n\u2013 Bosch Connected Industry\n\u2013 Robert Bosch Manufacturing\nSolutions GmbH\nEnergy and Building\nTechnology\nMobility\n\u2013 Building Technologies\n\u2013 Bosch eBike Systems \u2013 Home Comfort\n\u2013 Cross-Domain Computing Solutions \u2013 Bosch Global Service Solutions\n\u2013 Electrified Motion\n\u2013 Mobility Aftermarket \u2013 Robert Bosch Smart Home GmbH\n\u2013 Mobility Electronics\n\u2013 Power Solutions\n\u2013 Vehicle Motion\n\u2013 Bosch Engineering GmbH\n\u2013 ETAS GmbH\n\u2013 ITK Engineering GmbH\n\u2013 Mobility Platform and Services\n\u2013 Two-Wheeler and Powersports Other activities\n\u2013 Bosch Healthcare Solutions GmbH\n\u2013 Bosch Business Innovations GmbH\n(until Dec. 31, 2024: grow platform GmbH)\n\u2013 Robert Bosch Venture Capital GmbH 1. Bosch Rexroth AG (100 % Bosch-owned)\n4202\ntroper\nlaunnA\nThe Bosch Group\nBusiness sectors",
            "drives for e-bikes and e-scooters, for thermal management,\nand for wiper and steering\/braking systems. The product Power Solutions\nrange also includes drive systems for convenience features The Power Solutions division\u2019s portfolio focuses on combus-\nsuch as window lifters, seat adjustment mechanisms, and tion engines, the hydrogen economy, and thermal systems,\nsunroofs. as well as on software, services, and control units. Depend-\ning on the type of fuel, it manufactures components such\nMobility Aftermarket as injectors, pumps, ignition systems, and injection systems,\nThe automotive spare parts market is Mobility Aftermarket\u2019s as well as transmissions, sensors, exhaust-gas treatment\nmain area of business, where it serves the aftermarket and systems, and 48-volt batteries. For the hydrogen economy,\nworkshops. The range of spare parts includes components Power Solutions offers components, systems, and services\n4202\ntroper\nlaunnA\nGroup management report",
            "4 RBIN\/P | 2022-08-10\nAnnual Investor Meet 2022 | Bosch Ltd.\n\u00a9 Bosch Limited 2022. All rights reserved, also regarding any disposal, exploitation, reproduction, editing, distribution, aswell as in the event of applications for industrial property rights.\nAnnual Investor Meet 2022 | Bosch Ltd.\nBosch Global, Bosch India & Bosch Ltd.\nBosch Global Bosch India Bosch Ltd.\nOwnership\n94% Bosch Ltd. Bosch Global Bosch Chassis\nSoftware Tech. Systems India Ltd.\nCharitable Robert\nPower Tools\nBosch Foundation\nPowertrain Solutions\n5%\nBuilding Technologies\nBosch family\nBosch Automotive BSH Home Bosch Rexroth Ltd.\n1% Electronics Pvt. Ltd. Appliances\nRobert Bosch\nAutomotive\nTwo-Wheeler &\nGmbH Aftermarket\nPowersports\n78.7 402,600 230\n114 7,550 6\nBosch Electrical Automotive ETAS\nSales in bEUR Associates Manufacturing\nDrives India Pvt. Ltd Steering India Pvt.\nIn 2021 Locations Ltd. Revenue Sales in Associates Manufacturing\nbINR in 2021 facilities"
        ],
        "response":"The Two-Wheeler and Powersports business unit's portfolio includes safety and assistance systems, displays, connectivity functions, control units, and components for both combustion engines and electric motors for two-wheelers, three-wheelers, and powersports vehicles.",
        "reference":"Safety and assistance systems, displays, connectivity functions, control units, and components for both combustion engines and electric motors for two-wheelers, three-wheelers, and powersports vehicles.",
        "faithfulness":1.0,
        "answer_relevancy":1.0,
        "context_precision":1.0,
        "context_recall":1.0
    },
    {
        "user_input":"What is the registered office of BSH \u00e9lectrom\u00e9nagers S.A.?",
        "retrieved_contexts":[
            "Morocco BSH Electrom\u00e9nagers (SA) Casablanca 100.0\nKeenfinity SAS Casablanca 100.0\nRobert Bosch Morocco S.A.R.L.-A.U. Casablanca 100.0\nMozambique Bosch Rexroth Mozambique Lda. Maputo 100.0\nBosch Rexroth Matola Lda. Matola 100.0\nNamibia Bosch Rexroth Namibia (Pty.) Ltd. Walvis Bay 100.0\nNew Zealand BSH Home Appliances Ltd. Auckland 100.0\n4202\ntroper\nlaunnA\n206\nThe Bosch Group Robert Bosch Stiftung Group management report Consolidated financial statements Additional information\nList of shareholdings of the Bosch Group\n207\nPercentage share\nRegion \/ country Company name Registered office of capital\nPhilippines Bosch Service Solutions, Inc. Manila 100.0\nRobert Bosch Inc. Manila 100.0\nSingapore AquaEasy Pte. Ltd. Singapore 100.0\nBosch Rexroth Pte. Ltd. Singapore 100.0\nBSH Home Appliances Pte. Ltd. Singapore 100.0\nELPRO Pte. Ltd. Singapore 100.0\nKeenfinity Pte. Ltd. Singapore 100.0\nRobert Bosch (South East Asia) Pte. Ltd. Singapore 100.0",
            "Holger Christiansen Italia S.r.l. San Lazzaro di Savena 100.0\nROBERT BOSCH S.p.A. Societ\u00e0 Unipersonale Milan 100.0\nTecnologie Diesel S.p.A. Societ\u00e0 Unipersonale Modugno (Bari) 100.0\nKazakhstan BSH Home Appliances LLP Almaty 100.0\nTOO Robert Bosch Almaty 100.0\n4202\ntroper\nlaunnA\n193\nThe Bosch Group Robert Bosch Stiftung Group management report Consolidated financial statements Additional information\nList of shareholdings of the Bosch Group\n194\nPercentage share\nRegion \/ country Company name Registered office of capital\nLatvia Robert Bosch SIA Riga 100.0\nLuxembourg BSH \u00e9lectrom\u00e9nagers S.A. Senningerberg 100.0\nFerroknepper Buderus S.A. Esch-sur-Alzette 100.0\nNetherlands Bosch Energy and Building Solutions B.V. Nieuwegein 100.0\nBosch Power Tools B.V. Breda 100.0\nBosch Rexroth B.V. Boxtel 100.0\nBosch Security Systems B.V. Eindhoven 100.0\nBosch Thermotechniek B.V. Deventer 100.0\nBosch Transmission Technology B.V. Tilburg 100.0\nBSH Huishoudapparaten B.V. Amsterdam 100.0",
            "BSH Home Appliances General Trading LLC Dubai 100.0\nKeenfinity FZCO Dubai 100.0\nRobert Bosch Middle East FZE Dubai 100.0\nVietnam Bosch Vietnam Co., Ltd. Dong Nai Province 100.0\nBosch Global Software Technologies Co. Ltd. Ho Chi Minh City 100.0\nBSH Home Appliances (Vietnam) Co. Ltd. Ho Chi Minh City 100.0\nZambia Bosch Rexroth Zambia Ltd. Kitwe 100.0\n4202\ntroper\nlaunnA\n208\nThe Bosch Group Robert Bosch Stiftung Group management report Consolidated financial statements Additional information\nList of shareholdings of the Bosch Group\n209 2. Non-consolidated entities\nPercentage share\nRegion \/ country Company name Registered office of capital\nGermany AIG Planungs- und Ingenieurgesellschaft mbH Stuttgart 100.0\nBosch Climate Solutions GmbH Gerlingen 100.0\nBosch Management Support GmbH Leonberg 100.0\nBosch Pensionsfonds AG Stuttgart 100.0\nBSH Altersf\u00fcrsorge GmbH Munich 100.0\nCircular Economy Solutions GmbH G\u00f6ttingen 100.0\neAx solutions GmbH Stuttgart 100.0",
            "SPLT M\u00c9XICO, S.A. DE C.V. Mexico City 100.0\nPanama Robert Bosch Panama Col\u00f3n, S.A. Panama City 100.0\nPeru BSH Electrodom\u00e9sticos S.A.C. Callao\/Lima 100.0\nRobert Bosch S.A.C. Lima 100.0\nUnited States Automotive Steering Column LLC Florence, KY 100.0\nBosch Automotive Service Solutions LLC Wilmington, DE 100.0\nBosch Automotive Workshop Services LLC Wilmington, DE 100.0\nBosch Aviation Technology LLC Novi, MI 100.0\nBosch Brake Components LLC Oakbrook Terrace, IL 100.0\nBosch grow platform LLC Wilmington, DE 100.0\nBosch Mobility Platform & Solutions LLC Wilmington, DE 100.0\nBosch Rexroth Corporation Lehigh Valley, PA 100.0\nBosch Security Systems LLC Burnsville, MN 100.0\nBosch Service Solutions North America LLC Wilmington, DE 100.0\n4202\ntroper\nlaunnA\n200\nThe Bosch Group Robert Bosch Stiftung Group management report Consolidated financial statements Additional information\nList of shareholdings of the Bosch Group\n201\nPercentage share\nRegion \/ country Company name Registered office of capital",
            "three-wheelers, and powersports vehicles.\nBSH Hausger\u00e4te\nIndustrial Technology business sector The BSH Hausger\u00e4te product portfolio ranges from wash-\nThe Industrial Technology business sector comprises the ing machines and tumble dryers through refrigerators and\nDrive and Control Technology division (Bosch Rexroth), other freezers, stoves and ovens, and dishwashers, to small appli-\nactivities in the field of special-purpose mechanical engi- ances such as vacuum cleaners, automatic coffee makers,\nneering, and Industry 4.0 software solutions and services. and food processors. The division brings together the global\nBosch, Siemens (under license), and Gaggenau brands. BSH\nDrive and Control Technology also uses regional and local brands such as Balay, Neff, Pro-\nBosch Rexroth AG specializes in drive and control technolo- filo, and Thermador. There is also the Home Connect eco-"
        ],
        "response":"The registered office of BSH \u00e9lectrom\u00e9nagers S.A. is Senningerberg, Luxembourg.",
        "reference":"Senningerberg",
        "faithfulness":1.0,
        "answer_relevancy":0.9827360314,
        "context_precision":0.5,
        "context_recall":1.0
    },
    {
        "user_input":"Who is the intended buyer of the Building Technologies division\u2019s product business for security and communication technology?",
        "retrieved_contexts":[
            "company. We want this aspiration to be reflected in our tended sale of the Building Technologies division\u2019s product\nfinancial targets as well. With regard to sales, our aim is aver- business for security and communication technology (Energy\nage annual growth of 6 to 8 percent between now and 2030, and Building Technology business sector) to funds advised\ngiven normal inflation rates of 2 to 3 percent. In this context, by Triton Investments Advisers LLP, United Kingdom.\nwe take our lead from the European Central Bank\u2019s medium-\n4202\ntroper\nlaunnA\nGroup management report\nProspects for the Bosch Group\n46\nThe Bosch Group Robert Bosch Stiftung Consolidated financial statements Additional information\nAmple opportunities Electrification is of particular importance for Mobility, our\nFor the Bosch Group, there are considerable growth oppor- biggest business sector. Despite regional differences in the",
            "applications need for full connectivity. Global Service Solutions divisions.\nConsumer Goods business sector Building Technologies\nThe Consumer Goods business sector comprises the Power The Building Technologies division specializes in the regional\nTools and BSH Hausger\u00e4te divisions. systems integration business, offering solutions and cus-\ntomized services for building security, energy efficiency, and\nPower Tools building automation in selected countries. The focus is on\nThis division\u2019s extensive product range serves both pro- commercial buildings and infrastructure projects. The port-\nfessional users in trade and industry and do-it-yourselfers. It folio also includes fire-alarm systems. Agreements for the\noffers power tools (such as hammer drills, cordless screw- divestment of the division\u2019s remaining product business,\ndrivers, jigsaws), garden tools (such as lawn mowers, hedge which had already been planned in 2023, were signed at the",
            "which is not tax deductible and mainly represents part of the Building Technologies division\u2019s product business (Energy\nsynergy potential and the value of the workforce. The good- and Building Technology business sector) would be sold.\nwill is allocated to the Building Technologies division. This concerns the Video, Access and Intrusion, and Commu-\nnication business units. The sale will be effected by transfer-\nNo adjustments were made in relation to the carrying ring shares in separate legal entities. The related contracts\namounts recognized in the previous year. were signed on December 12, 2024, and the transaction is\nexpected to be closed in the second quarter of 2025. The rea-\nNon-current assets held for sale and disposal groups son for the arranged sale is the realignment of the Building\nNon-current assets and disposal groups are classified as Technologies division, which is to focus in the future on its",
            "of the Building Technologies division\u2019s product business in advance of the acquisition in the HVAC business planned\nhave been ignored. When calculated on a comparable basis, by Home Comfort. The same applies to the costs arising\nwe expect a year-on-year increase in sales revenue in the in the course of carving out major parts of the Building Tech-\nrange of 2 to 4 percent. nologies division\u2019s product business in the course of the\nplanned sale.\nResult forecast for 2025\nOur expectations for result are also subject to considerable Expectation for NWC and FCF in 2025\nuncertainty. On the level of the Bosch Group and of the Disregarding the announced transactions in the Energy and\nEnergy and Building Technology business sector, moreover, Building Technology business sector, our aim is to achieve\nany effects from the planned acquisition in the HVAC busi- an FCF-to-sales ratio on a par with the previous year.\nness by the Home Comfort division and from the announced",
            "The acquisition expands the Building Technologies division\u2019s\nThe carrying amount of the investments in the abovemen- services portfolio (Energy and Building Technology busi-\ntioned associated entities corresponds to the proportionate ness sector) in building security in the Netherlands.\nshare in these entities\u2019 equity.\nOn August 6, the Bosch Group acquired the assets and liabil-\nBusiness combinations ities of Engineered Control Systems, Inc., based in Fuquay-\nBusiness combinations in the reporting year Varina, NC, United States. The acquired business with build-\nThe following individually immaterial acquisitions were ing automation solutions for the efficient control, regulation\nclosed in the reporting year: and monitoring of technical building equipment is allocated\nto the Building Technologies division (Energy and Building\nOn January 2, the Bosch Group acquired 100 percent of Technology business sector).\nthe shares in MIIT Mechatronics Industries GmbH, Vienna,"
        ],
        "response":"The intended buyer of the Building Technologies division\u2019s product business for security and communication technology is Triton Investments Advisers LLP, United Kingdom.",
        "reference":"Funds advised by Triton Investments Advisers LLP, United Kingdom.",
        "faithfulness":0.5,
        "answer_relevancy":1.0,
        "context_precision":0.9999999999,
        "context_recall":1.0
    },
    {
        "user_input":"What is included in the condensed financial information on fully consolidated subsidiaries?",
        "retrieved_contexts":[
            "Included in consolidation at December 31, 2024 73 418 491\nThe consolidated group includes four special funds, as well Due to changes to the consolidated group, sales revenue\nas other investments. decreased by EUR 138 million in the reporting year and\ntotal assets as of December 31, 2024, decreased by\nEUR 149 million.\n4202\ntroper\nlaunnA\n101\nThe Bosch Group Robert Bosch Stiftung Group management report Consolidated financial statements Additional information\nNotes to the consolidated financial statements\n102 Condensed financial information on fully consolidated\nsubsidiaries with material non-controlling interests\nT 10\nin millions of euros\nBosch Powertrain United Automotive\nSystems Co., Ltd., Electronic Systems Co., Ltd.,\nWuxi, China Shanghai, China\n2024 2023 2024 2023\nCurrent assets 1,719 1,679 3,660 2,846\nNon-current assets 431 419 1,524 1,506\nCurrent liabilities 957 1,063 2,415 2,032\nNon-current liabilities 2 3 380 236\nSales revenue 1,516 1,829 5,268 4,780",
            "G 05 Sales revenue, 2020\u20132024 T 06 Consolidated statement of changes in equity 93\n(in millions of euros) 60\nT 07 Consolidated statement of cash flows 94\nG 06 EBIT, 2020\u20132024 (in millions of euros) 60\nT 08 Exchange rates 98\nG 07 Sales revenue by region (in billions of euros) 63\nT 09 Development of the consolidated group 101\nG 08 Sales revenue by region, 2024\nT 10 Condensed financial information on fully\n(percentage figures) 63\nconsolidated subsidiaries with material\nG 09 Sales revenue by business sector non-controlling interests (I) 102\n(in billions of euros) 64\nT 11 Condensed financial information on fully\nG 10 Sales revenue by business sector, 2024 consolidated subsidiaries with material\n(percentage figures) 65 non-controlling interests (II) 103\nG 11 Research and development cost, 2020\u20132024 T 12 Condensed financial information on individually\n(in millions of euros) 67 immaterial joint ventures 104",
            "Profit\/loss after tax attributable to non-controlling interests 99 102 67 52\nEquity attributable to non-controlling interests 388 335 469 425\nDividends paid to non-controlling interests 0 85 36 47\nThe condensed financial information of the respective enti- the related line items in the consolidated financial state-\nties corresponds to the figures before consolidation entries. ments. Investments in joint ventures within the meaning of\nIFRS 11 are accounted for using the equity method in accor-\nJoint ventures and joint operations dance with IAS 28 Investments in Associates and Joint Ven-\nThe accounting for joint arrangements in accordance with tures. The carrying amount of these interests is subsequently\nIFRS 11 Joint Arrangements is based on whether they are measured in accordance with the change in equity of the\nclassified as a joint operation or a joint venture, which in turn jointly controlled entity attributable to the Bosch Group,",
            "the Power Solutions division. effects are considered and deferred taxes recognized.\n4202\ntroper\nlaunnA\n100\nThe Bosch Group Robert Bosch Stiftung Group management report Consolidated financial statements Additional information\nNotes to the consolidated financial statements\n101 Consolidated group\nBesides Robert Bosch GmbH, the consolidated group com-\nprises a further 490 (previous year: 468) fully consolidated\nentities. The group developed as follows:\nT 09\nOutside\nGermany Germany Total\nIncluded in consolidation at January 1, 2023 78 391 469\nAdditions\/formations in the fiscal year 2023 3 20 23\nDisposals\/mergers in the fiscal year 2023 \u20134 \u201319 \u201323\nIncluded in consolidation at December 31, 2023 77 392 469\nAdditions\/formations in the fiscal year 2024 3 34 37\nDisposals\/mergers in the fiscal year 2024 \u20137 \u20138 \u201315\nIncluded in consolidation at December 31, 2024 73 418 491\nThe consolidated group includes four special funds, as well Due to changes to the consolidated group, sales revenue",
            "Sec. 289f (4) HGB (disclosures on the quota for women on these requirements, give a true and fair view of the assets,\nexecutive boards). Furthermore, the other information com- liabilities, financial position and financial performance of the\nprises additional parts to be included in the annual report, of Group. In addition, the executive directors are responsible\nwhich we obtained a version prior to issuing this auditor\u2019s for such internal control as they have determined necessary\nreport, in particular the sections: \u201cForeword\u201d, \u201cBoard of man- to enable the preparation of consolidated financial state-\nagement\u201d, \u201cSupervisory board report\u201d, \u201cSupervisory board\u201d, ments that are free from material misstatement, whether\n\u201dIndustrial Trust and International Advisory Committee\u201d, due to fraud (i.e., fraudulent financial reporting and mis-\n\u201cBusiness sectors\u201d, \u201cHighlights 2024\u201d, \u201cStories\u201d and \u201cRobert appropriation of assets) or error.\nBosch Stiftung\u201d, but not the consolidated financial state-"
        ],
        "response":"The condensed financial information on fully consolidated subsidiaries includes current assets, non-current assets, current liabilities, non-current liabilities, and sales revenue for each subsidiary.",
        "reference":"Condensed financial information on fully consolidated subsidiaries with material non-controlling interests.",
        "faithfulness":0.8,
        "answer_relevancy":0.9781274978,
        "context_precision":1.0,
        "context_recall":1.0
    },
    {
        "user_input":"What are the main pillars of the Drive and Control Technology division's efforts to expand its activities?",
        "retrieved_contexts":[
            "automotive aftermarket, steering systems for passenger efficiency, and building automation\ncars and commercial vehicles, connected mobility services, \u2013 Home comfort (heating, cooling, and well-being\nas well as activities in electromobility, control devices, sen- in buildings)\nsor technology, and semiconductors, and a wide-ranging \u2013 Service solutions (business solutions for internal\nportfolio for e-bikes. and external customers, shared services for the Bosch\nGroup)\nThe Industrial Technology business sector combines the\nfollowing activities: Operating segments which are not reportable are combined\nand presented in the category \u201cOther.\u201d This mainly relates to\n\u2013 Automation technology (technologies for drives, financial, holding, and other service companies as well as\ncontrols, and motion) operations that are not allocated to a business sector.\n\u2013 Industry 4.0 software activities and projects\nThe divisions allocated to a business sector are aggregated",
            "and control technologies. Our end-to-end drive and control control systems is the perfect solution for applications that\nconcepts likewise help to handle complex tasks in a fl exible require high accuracy and reliability\nmanner. Maximum fl exibility and carefully coordinated compo- Universal drive and control concepts for\nnents boost your productivity. fl exible realization of complex tasks Broad range of components and systems solutions for\nany drive and control technology\nReliable tightening technology with seamless\ndocumentation to ensure safety and functionality\nAll required drive and control technologies from\none supplier\nboschrexroth.com\nSolution provided by: Bosch Rexroth\n35\nAUTOMOTIVE\nPRODUCTION\n36\nThe Bosch Group\nThe Bosch Group is a leading global supplier of technology and ser-\nvices. Its operations are divided into four business sectors: Mobility\nsolutions, industrial technology, consumer goods, and energy and",
            "business sectors are the responsibility of the divisions.\n4202\ntroper\nlaunnA\n154\nThe Bosch Group Robert Bosch Stiftung Group management report Consolidated financial statements Additional information\nNotes to the consolidated financial statements\n155 The Mobility business sector mainly comprises the following The Energy and Building Technology business sector com-\nareas of business: powertrain products and solutions as well prises the following activities:\nas systems for active and passive driving safety, assistance\nand convenience functions, technology for user-f riendly info- \u2013 Security systems (video surveillance, public address\ntainment and vehicle-to-vehicle and vehicle-t o-infrastructure systems, evacuation systems, and access control)\ncommunication, concepts, technology, and services for the \u2013 Solutions and services for building security, energy\nautomotive aftermarket, steering systems for passenger efficiency, and building automation",
            "concluded in 2024. As a company with global operations assisted, combined lateral and longitudinal control of vehi-\nthat takes its social responsibility very seriously, Bosch sup- cles (UN R 171 on Driver Control Assistance Systems\nports the proposal and has set out its position in bilateral (DCAS)) at SAE Level 2. We are continuing to work on the\ntalks with policymakers. At the same time, we advocate for market launch of automated driving solutions based on our\na risk-based approach to implementing the law to enable\ntargeted and effective implementation.\n4202\ntroper\nytilibaniatsuS\nStrategy and management Environment Social Governance Annex\n96\nPolitical lobbying\nexperiences in the field with these driver assistance sys- Federal Association for Information Technology, Telecom-\ntems and our extensive pre-development activities for com- munications, and New Media (BITKOM), and the German",
            "\u2013 Information Technology and Digitalization\n\u2013 ETAS\n\u2013 Software and Digital Solutions\n\u2013 Mobility Aftermarket\n\u2013 Software Next\n\u2013 Mobility Electronics\n\u2013 Mobility Platform and Services Business areas\n\u2013 Power Solutions\n\u2013 Bosch Manufacturing Solutions SINCE FEBRUARY 1, 2024\n\u2013 Two-Wheeler and Powersports\n\u2013 Bosch Connected Industry\n\u2013 Vehicle Motion\n\u2013 Drive and Control Technology SINCE FEBRUARY 1, 2024\n\u2013 Bosch Global Service Solutions\nUNTIL SEPTEMBER 30, 2024\nRegions\n\u2013 Europe 2, Japan, Korea, North America,\nOceania UNTIL JANUARY 31, 2025, South America\n4202\ntroper\nlaunnA\nThe Bosch Group\nThe Bosch board of management\nRobert Bosch Stiftung Group management report Consolidated financial statements Additional information\nExtended executive management Mobility sector Presidents\n14\nboard of the divisions\nDr. Markus Heyn Claus Fleischer Jan Brockmann\nChairman Bosch eBike Systems Home Comfort\nVolker Schilling Henning von Boxberg Rupert Hoellbacher"
        ],
        "response":"The main pillars of the Drive and Control Technology division's efforts to expand its activities include end-to-end drive and control concepts that help handle complex tasks flexibly, maximum flexibility of components to boost productivity, a broad range of components and systems solutions for drive and control technology, and reliable tightening technology with seamless documentation to ensure safety and functionality. These elements are designed to provide comprehensive solutions from one supplier for various applications.",
        "reference":"The main pillars of these efforts are the further development of existing products, innovations in software-based services, and the broadening of our international presence, also through sales partners.",
        "faithfulness":1.0,
        "answer_relevancy":1.0,
        "context_precision":0.0,
        "context_recall":0.0
    },
    {
        "user_input":"What is the principal place of business for the joint operation between Robert Bosch GmbH and CARIAD SE?",
        "retrieved_contexts":[
            "idated financial statements as of December 31, 2024, using in these entities\u2019 equity.\nthe equity method in accordance with IAS 28:\nSince 2022, a cooperation arrangement has been in place\n\u2013 Bosch BASF Smart Farming GmbH, Cologne, Germany between Robert Bosch GmbH and the Volkswagen group\n(50 percent), entity CARIAD SE, Wolfsburg, Germany, for the develop-\n\u2013 BS Systems GmbH & Co. KG, Zusmarshausen, Germany ment of a software platform for partially and highly auto-\n(50 percent), mated driving. The principal place of business of the joint\n\u2013 MAGURA Bosch Parts & Services GmbH & Co. KG, operation is Ingolstadt, Germany. The development costs\nN\u00fcrtingen, Germany (50 percent), incurred are shared equally between the parties. Each party\n\u2013 North America Fuel Systems Remanufacturing LLC, is granted rights to use and market the jointly developed\nKentwood, MI, United States (50 percent). results; the results of engineering work are not marketed\njointly.",
            "classified as a joint operation or a joint venture, which in turn jointly controlled entity attributable to the Bosch Group,\ndepends on the contractually agreed rights and obligations less any impairment, where appropriate.\nof the parties to the arrangement. With regard to joint opera-\ntions, the Bosch Group recognizes, in relation to its interest,\nits rights to the assets, liabilities, expenses, and revenue in\n4202\ntroper\nlaunnA\n103\nThe Bosch Group Robert Bosch Stiftung Group management report Consolidated financial statements Additional information\nNotes to the consolidated financial statements\n104 The following joint ventures are subject to joint control in The carrying amount of the investments in the above-men-\naccordance with IFRS 11 and were recognized in the consol- tioned joint ventures corresponds to the proportionate share\nidated financial statements as of December 31, 2024, using in these entities\u2019 equity.\nthe equity method in accordance with IAS 28:",
            "1 %\nidated subsidiaries and regional companies in more than Robert Bosch GmbH 5 %\n60 countries. The parent company is Robert Bosch GmbH, ERBO II GmbH \/\nBosch family\nwhich is domiciled in Stuttgart, Germany. It started out as\n\u201cWorkshop for Precision Mechanics and Electrical Engineer-\ning,\u201d founded in Stuttgart in 1886 by Robert Bosch (1861\u2013\n1942). Robert Bosch Stiftung GmbH has been the majority\nshareholder in Robert Bosch GmbH since 1964.\n94 %\nDespite holding roughly 94 percent of the share capital, this\nRobert Bosch\nlimited liability company with a charitable purpose has no Stiftung GmbH\ninfluence on the strategic or business orientation of the\nBosch Group. A further roughly 5 percent of the share capital\nis held by the not-for-profit ERBO II GmbH, established by G 03\nthe founder\u2019s descendants, and some 1 percent by Robert Shareholders of Robert Bosch GmbH\nBosch GmbH itself. Of the voting rights, some 93 percent are Voting rights",
            "companies in some 60 countries. Including sales and service partners,\nBosch\u2019s global manufacturing and sales network covers nearly every\ncountry in the world. The basis for the company\u2019s future growth is its\ninnovative strength. At 120 locations across the globe, Bosch employs\na huge number of associates in research and development.\nThe company was set up in Stuttgart in 1886 by Robert Bosch\n(1861-1942) as \u201cWorkshop for Precision Mechanics and Electrical\nEngineering\u201d. The special ownership structure of Robert Bosch GmbH\nguarantees the entrepreneurial freedom of the Bosch Group, making it\npossible for the company to plan over the long term and to under-\ntake significant up-front investments in the safeguarding of its future.\nNinety-two percent of the share capital of Robert Bosch GmbH is held\nby Robert Bosch Stiftung GmbH, a charitable foundation. The majority\nof voting rights are held by Robert Bosch Industrietreuhand KG, an",
            "The company was set up in Stuttgart in 1886 by Robert Bosch (1861\u20131942) as\n\u201c Workshop for Precision Mechanics and Electrical Engineering.\u201d The special ownership\nstructure of Robert Bosch GmbH guarantees the entrepreneurial freedom of the\nBosch Group, making it possible for the company to plan over the long term and to\nundertake significant upfront investments in the safeguarding of its future. Ninety-four\npercent of the share capital of Robert Bosch GmbH is held by Robert Bosch Stiftung\nGmbH, a limited liability company with a charitable purpose. The remaining shares are\nheld by Robert Bosch GmbH and by a corporation owned by the Bosch family. The\nmajority of voting rights are held by Robert Bosch Industrietreuhand KG.\n4202\ntroper\nlaunnA\nThe Bosch Group\nBosch at a glance\nRobert Bosch Stiftung Group management report Consolidated financial statements Additional information\nForeword\n08\nLadies and gentlemen,\n\u201cAmbitions,\u201d the title of our annual report, is intended as a"
        ],
        "response":"The principal place of business for the joint operation between Robert Bosch GmbH and CARIAD SE is Ingolstadt, Germany.",
        "reference":"Ingolstadt, Germany",
        "faithfulness":1.0,
        "answer_relevancy":0.9936861901,
        "context_precision":0.9999999999,
        "context_recall":1.0
    },
    {
        "user_input":"What are some of the risk categories considered by the Bosch Group?",
        "retrieved_contexts":[
            "estimate for the worst-case, realistic, and best-case scenar- ing interrupted. One of the risks considered in the \u201cprojects\nios, in a ratio of 1:4:1. Risk reporting uses the residual method. and customers\u201d cluster looks at the implications of projects\nRisks with a probability of occurrence of at least 50 percent for individual customers being delayed. There is also the\nare still considered in our annual or interim sales revenue focal point of risks arising from legislation and regulations,\nand income forecasts as a matter of principle. including those relating to product safety, climate, and data\nprivacy. The most important risk categories also include the\nBosch Group\u2019s global supply chains. This includes factors\nsuch as the bankruptcy of critical suppliers and interrup-\ntions in supply.\n4202\ntroper\nlaunnA\nGroup management report\nReport on opportunities and risks\n80\nThe Bosch Group Robert Bosch Stiftung Consolidated financial statements Additional information",
            "Company\u2019s risk management framework and Bosch Group:\nwithout affecting the Company\u2019s vision content of the information and regardless of its\nassociated practices to mitigate those risks.\nand goals. carrier medium (e.g., paper, electronic files), \u25cf Openness, trust and legality\nthe following is taken into account: (compliance) according to the\nESG risks are an integral part of its\nstrategic focus area in risk management. Bosch values \u25cf Fulfilment of retention obligations",
            "Group. As far as possible, risks are identified and managed functions, technological innovations, and new business\nwhere they arise: in other words, above all in the divisions models, and in this way may significantly affect the Bosch\nand their regional subsidiaries. The latter organizational Group\u2019s business. In addition, a cross-functional risk com-\nunits are also primarily responsible for introducing mea- mittee is tasked with identifying significant risk areas across\nsures to reduce or control risks. the operating units and pinpointing potentially disruptive\nrisks.\nWhile the corporate departments for compliance, risk man-\nagement, and internal control system exercise a governance\nfunction for their respective systems, specialist departments\nsuch as the legal services and tax departments support,\n4202\ntroper\nlaunnA\nGroup management report\nReport on opportunities and risks\n79\nThe Bosch Group Robert Bosch Stiftung Consolidated financial statements Additional information",
            "4202\ntroper\nlaunnA\nGroup management report\nReport on opportunities and risks\n79\nThe Bosch Group Robert Bosch Stiftung Consolidated financial statements Additional information\nOverall risk assessment As in the previous year, we have determined a number of the-\nWe are not currently aware of any risks, beyond those listed matic focal points under which individual risks are clustered.\nin this report, which could materially affect the net assets, These focal points take their lead from the size of the aggre-\nfinancial position, and results of operations of the Bosch gate financial risk.\nGroup in 2025. From a current perspective, there are no risk\nexposures that could jeopardize the Bosch Group\u2019s contin- The most important focal point is hybrid globalization. In\nued existence as a going concern. connection with this, mention should be made of the special\nrisks of a global proliferation of tariff barriers, with its effect",
            "agement encompasses the entire company, including all\nessential operations, functions, divisions, and business\nsectors. The Bosch Group\u2019s risk management system is\nbased on the ISO 31000 and COSO III (ERM) standards, as\nwell as IDW PS 340. It comprises the systematic detection\nand tracking of relevant risks and, where necessary, identifi-\ncation and monitoring of measures to manage these risks. In\nthis context, the corporate coordinating office for the risk\nmanagement system is responsible for continuously refin- The topics inside the quadrants are listed according to their mention in the ESRS, so conclusions cannot be drawn from the\norder with regard to the relevance of the individual topics. The aggregated presentation of the topics is based on an\ning the system. For further information and a description of\nassessment at the level of the sub-topics.\nmaterial risks, see the 2024 annual report, page 79 et seq.\nThe material antitrust and legal risks are also described\nthere.\n4202"
        ],
        "response":"Some of the risk categories considered by the Bosch Group include risks arising from legislation and regulations, such as product safety, climate, and data privacy. Additionally, significant risks are associated with global supply chains, including the bankruptcy of critical suppliers and interruptions in supply. Other focal points include project delays for individual customers and material antitrust and legal risks.",
        "reference":"The most important risk categories include risks related to infrastructure and cybersecurity, implications of project delays for individual customers, legislation and regulations regarding product safety, climate, data privacy, and global supply chains.",
        "faithfulness":1.0,
        "answer_relevancy":0.9999996882,
        "context_precision":0.9999999999,
        "context_recall":0.75
    },
    {
        "user_input":"What types of products are included in the Consumer Goods business sector?",
        "retrieved_contexts":[
            "applications need for full connectivity. Global Service Solutions divisions.\nConsumer Goods business sector Building Technologies\nThe Consumer Goods business sector comprises the Power The Building Technologies division specializes in the regional\nTools and BSH Hausger\u00e4te divisions. systems integration business, offering solutions and cus-\ntomized services for building security, energy efficiency, and\nPower Tools building automation in selected countries. The focus is on\nThis division\u2019s extensive product range serves both pro- commercial buildings and infrastructure projects. The port-\nfessional users in trade and industry and do-it-yourselfers. It folio also includes fire-alarm systems. Agreements for the\noffers power tools (such as hammer drills, cordless screw- divestment of the division\u2019s remaining product business,\ndrivers, jigsaws), garden tools (such as lawn mowers, hedge which had already been planned in 2023, were signed at the",
            "controls, and motion) operations that are not allocated to a business sector.\n\u2013 Industry 4.0 software activities and projects\nThe divisions allocated to a business sector are aggregated\nThe operations of the Consumer Goods business sector into a single reportable segment, as they have similar eco-\ncomprise the production and distribution of: nomic characteristics. Above all, the economic performance\nof all the divisions aggregated in one segment depends to a\n\u2013 Power tools (tools for professionals, industry, and DIY, similar extent on the same core markets (automotive produc-\naccessories, garden tools, as well as industrial tools tion, capital goods, consumer goods, and energy and build-\nand measuring equipment) ing technology).\n\u2013 Household appliances (appliances for cooking, washing-\nup, laundry, drying, cooling, freezing, floor care, etc.) Line items allocable to financing activities are not included\nin segment reporting as they are not part of the reported\nearnings.\n4202\ntroper",
            "TechnologyTechnology\ntechnology and services. Its operations are divided\ninto four business sectors. Universal trends such\nas automation, electrification, digitalization, and\nconnectivity, as well as an orientation to sustain -\nability, are increasingly determining the group\u2019s Energy andEnergy and\nConsumer Consumer\nbusiness operations. Goods Goods Building Building\nTechnologyTechnology\nT H E G L O B A L B O S C H T E A M S A L E S A N D E A R N I N G S 2 0 2 4\nin billions of euros\n90.3\n417 900\nsales\n3.1\nassociates\nEBIT from operations\nThe Bosch Group More than 150 natio n-\ncomprises Robert alities work at Bosch,\n150\nBosch GmbH and its contributing each day\nroughly 490 subsidiary to the company\u2019s\nand regional companies success.\nsubsidiaries nationalities\nin over 60 countries. and regional companies\n1\nplace\nst\nR E S E A R C H A N D D E V E L O P M E N T\nin patent registrations\n7.8 1 in 5\nin Germany.\nAnd a forerunner in AI\npatents in Europe.",
            "Goods 61.8 %\nvelopments, especially in Europe. This region accounts for Mobility\n42 percent of our sales revenue. In addition, sales revenue\n0.4 %\ngrowth in areas of future importance such as electromobility Other activities\nand automated driving fell significantly short of our own\nplans. This also applies in particular to the European mar-\nket, where demand for these technologies is developing In the Consumer Goods business sector, demand appears\nmore slowly than expected. Moreover, our forecasts for the to be stabilizing after the sharp slump that followed the\nAmericas were not met, also in the market for trucks. The coronavirus pandemic-related boom. For example, retail\ne-bike business felt the effects of persistent weakness in the sales picked up again over the course of 2024. However, the\nconsumer goods markets. situation in the construction industry remains unsatisfactory\nacross the globe. Against this backdrop, the business sector",
            "consumer goods markets. situation in the construction industry remains unsatisfactory\nacross the globe. Against this backdrop, the business sector\nAt 6.4 billion euros, sales revenue in the Industrial Technol- was able to increase its overall sales revenue by a nominal\nogy business sector was significantly below the previous 1.6 percent to 20.3 billion euros, from the previous year\u2019s fig-\nyear\u2019s figure of EUR 7.4 billion. This corresponds to a nominal ure of 19.9 billion euros. Adjusted for exchange-rate effects,\ndecline of 13.0 percent, or 12.5 percent after adjusting for sales revenue increased by 2.9 percent and was thus only\nexchange-rate effects. A key role in this was played by the slightly below the forecast range of 3 to 5 percent. Looked\nsteeper than expected decline in the construction and at by division, sales revenue at BSH Hausger\u00e4te developed\nmachinery sectors in the main markets of Europe, North better than at Power Tools."
        ],
        "response":"The Consumer Goods business sector includes the production and distribution of power tools, accessories, garden tools, household appliances (such as appliances for cooking, washing-up, laundry, drying, cooling, freezing, floor care), and industrial tools and measuring equipment.",
        "reference":"Power tools and household appliances.",
        "faithfulness":0.7692307692,
        "answer_relevancy":0.9328736567,
        "context_precision":1.0,
        "context_recall":1.0
    },
    {
        "user_input":"Who is the Chairman of the shareholders\u2019 meeting?",
        "retrieved_contexts":[
            "directors, of whom eight (including the Chairman) of the Company is committed to defining\nare non-executive directors and six are independent and practicing the highest level of Corporate\ndirectors (including two women directors). The Governance. We recognize that governance and\nBoard carries out dual functions of overseeing the ethics represent the cornerstone of a stable and\nmanagement of the Company and representing sustainable organization.\nthe shareholders.\nBOARD COMMITTEES\nThe Board\u2019s oversight responsibilities are further\ndelegated among the following committees:\n\u25cf Audit Committee\n\u25cf Nomination and Remuneration Committee\n\u25cf Corporate Social Responsibility Committee\n\u25cf Risk Management Committee\n\u25cf Stakeholders Relationship Committee\nFor further details refer the Corporate\nGovernance Report in this Annual Report.\nIn the long term, an honest\nand fair approach to doing\nbusiness will always be the\nmost profitable.",
            "Board of Directors\n\nDesignation\n\nSuresh BR\n\n07766334 | Director\n\n2. | Sandeep 08264554 | Director\nNelamangala\nKarin Gilges | 09615158 | Director\n\nNote: During the year Mr. Karsten Mueller\nresigned from the Directorship with effect\nfrom November 10, 2023, and Ms. Karin\nGilges got appointed as Additional Director\nfrom November 10, 2023. Ms. Karin will be\nappointed as Director subject to the approval\nof shareholders at the Fourteenth AGM\n\nBoard Meetings\n\nDuring the Financial Year ended\nMarch 31, 2024, 4 meetings of the Board of\nDirectors were held on: May 2, 2023;\nJune 15, 2023; October 5, 2023, and\nJanuary 24, 2024.\n\nMICO TRADING PRIVATE LIMITED\n\nRisk Management\n\nSince the Company has not commenced any\nbusiness no specific Risk Management Policy\nhas been formulated. However, the Company\nis guided by the Risk Management Policy of\nits Parent Company i.e. Bosch Limited.\n\nDetails of Loans, Guarantee and\n\nInvestment",
            "chairman of the supervisory board was regularly informed by\nthe chairman of the board of management about current\ndevelopments and significant events in the company.\nProf. Stefan Asenkerschbaumer\nChairman\n4202\ntroper\nlaunnA\nThe Bosch Group\nSupervisory board report\n16\nRobert Bosch Stiftung Group management report Consolidated financial statements Additional information\nSupervisory board\n17\nProf. Stefan Asenkerschbaumer Dr. Christof Bosch Mario Gutmann\nStuttgart K\u00f6nigsdorf Bamberg\nChairman Spokesperson for the Bosch family Chairman of the works council of the Bamberg\nManaging partner of Robert Bosch Industrie- plant, and member of the central works council\ntreuhand KG, formerly deputy chairman of the of the Mobility business sector as well as\nboard of management of Robert Bosch GmbH Dr. Arne Fischer chairman of the economic committee of the\nMobility business sector\nGemmrigheim\nDirector of strategic projects, Power Solutions\nFrank Sell",
            "Chairman, Board of Directors, Mico) are seated as Andreas Nobis (then\nManaging Director, Mico) delivers a speech during the inauguration event\nof MAC.\nFar Left Bottom: (cid:55)(cid:75)(cid:72)(cid:3)(cid:192)(cid:85)(cid:86)(cid:87)(cid:3)(cid:71)(cid:72)(cid:80)(cid:82)(cid:3)(cid:70)(cid:68)(cid:85)(cid:3)(cid:68)(cid:87)(cid:3)(cid:48)(cid:36)(cid:38)(cid:3)(cid:76)(cid:80)(cid:83)(cid:82)(cid:85)(cid:87)(cid:72)(cid:71)(cid:3)(cid:73)(cid:85)(cid:82)(cid:80)(cid:3)(cid:42)(cid:72)(cid:85)(cid:80)(cid:68)(cid:81)(cid:92)\nmeant for EDC (electronic diesel control) customer training purpose.\nLeft: The Emission Test Lab at MAC for testing vehicle engines for their\ncompliance with the latest exhaust gas emission norms.\n49 | \nNone |",
            "Chairman, Board of Directors, Mico) are seated as Andreas Nobis (then\nManaging Director, Mico) delivers a speech during the inauguration event\nof MAC.\nFar Left Bottom: (cid:55)(cid:75)(cid:72)(cid:3)(cid:192)(cid:85)(cid:86)(cid:87)(cid:3)(cid:71)(cid:72)(cid:80)(cid:82)(cid:3)(cid:70)(cid:68)(cid:85)(cid:3)(cid:68)(cid:87)(cid:3)(cid:48)(cid:36)(cid:38)(cid:3)(cid:76)(cid:80)(cid:83)(cid:82)(cid:85)(cid:87)(cid:72)(cid:71)(cid:3)(cid:73)(cid:85)(cid:82)(cid:80)(cid:3)(cid:42)(cid:72)(cid:85)(cid:80)(cid:68)(cid:81)(cid:92)\nmeant for EDC (electronic diesel control) customer training purpose.\nLeft: The Emission Test Lab at MAC for testing vehicle engines for their\ncompliance with the latest exhaust gas emission norms.\n49"
        ],
        "response":"The context does not specify who the Chairman of the shareholders\u2019 meeting is.",
        "reference":"Prof. Stefan Asenkerschbaumer",
        "faithfulness":1.0,
        "answer_relevancy":0.0,
        "context_precision":0.3333333333,
        "context_recall":1.0
    },
    {
        "user_input":"What two countries were emerging as manufacturing hubs for the next millennium due to skilled engineers and robust domestic demand?",
        "retrieved_contexts":[
            "component industry, the focus shifted recognition, especially if it were to export\nparticularly to India and China, which were more products. At the headquarters, Bosch\nemerging as the manufacturing hubs for decided that a changeover was necessary\nthe next millennium due to the availability to strengthen its business interests in\nof skilled engineers and robust domestic India. The Bosch brand architecture in\ndemand. At the same time, a new market India was also not in line with its global\nemerged \u2013 that of low-priced vehicles counterpart. Considering these factors, the\n(LPV). The Indian market was a growing decision was taken to tackle these issues\nurban market with a large number of with a brand-building project.\n(cid:192)(cid:85)(cid:86)(cid:87)(cid:16)(cid:87)(cid:76)(cid:80)(cid:72)(cid:3)(cid:70)(cid:68)(cid:85)(cid:3)(cid:82)(cid:90)(cid:81)(cid:72)(cid:85)(cid:86)(cid:3)(cid:68)(cid:81)(cid:71)(cid:3)(cid:80)(cid:76)(cid:91)(cid:72)(cid:71)(cid:3)",
            "Competition increased as several global\nAt the same time, it was realised that\nplayers entered the Indian market. Plenty\nMICO was a local brand with no\nof job opportunities were created, and the\ninternational brand equity. Bosch was a\nambitious middle-class Indian aspired for\nglobal brand, but lesser known in India.\na better quality of living.\nThese two worlds had to come together.\nIn the West, with the saturation of the auto Mico needed global credibility and\ncomponent industry, the focus shifted recognition, especially if it were to export\nparticularly to India and China, which were more products. At the headquarters, Bosch\nemerging as the manufacturing hubs for decided that a changeover was necessary\nthe next millennium due to the availability to strengthen its business interests in\nof skilled engineers and robust domestic India. The Bosch brand architecture in\ndemand. At the same time, a new market India was also not in line with its global",
            "mobility, industrial technology, consumer goods, and energy\nand building technology. As before, there are considerable\nopportunities for growth here.\nDigitalization, electrification, electronification, automation,\nDR. STEFAN HARTUNG\nsustainability, and emerging markets are still the main forces\ndriving developments. They are subjects that have been on\nour radar for quite some time now. In addition, we want to\ncontinue to extend our global presence, which even now\ncreates significant local value. Europe is our home base. But currently adopting technologies of the future such as electro-\nwe are also strengthening the Bosch Group\u2019s operations in mobility and automated driving. A better regional balance\nregions such as North America and Asia. Not least, this is our was also one of the reasons behind a major strategic move in\nresponse to the imminent changes in global trade relations, 2024 \u2013 the acquisition we plan in the heating, ventilation, and",
            "The Engineering and IT services subsidiary \u2013 Robert offer IT\/IT-enabled services for Vietnam and South-East\nBosch Engineering and Business Solutions Ltd., Asian region. Plans are on to make Vietnam the R&D and\nheadquartered at Bangalore \u2013 made several efforts manufacturing hub for Bosch in South-East Asia along\ntowards expanding operations and research activities. with India.\nThese initiatives place the software activities of Bosch\nin India in an enviable position:\n(cid:55)(cid:75)(cid:72)(cid:3)(cid:192)(cid:85)(cid:86)(cid:87)(cid:16)(cid:82)(cid:73)(cid:16)(cid:76)(cid:87)(cid:86)(cid:16)(cid:78)(cid:76)(cid:81)(cid:71)(cid:3)(cid:40)(cid:38)(cid:56)(cid:3)(cid:53)(cid:72)(cid:79)(cid:76)(cid:68)(cid:69)(cid:76)(cid:79)(cid:76)(cid:87)(cid:92)(cid:3)(cid:55)(cid:72)(cid:86)(cid:87)(cid:76)(cid:81)(cid:74)(cid:3)(cid:38)(cid:72)(cid:81)(cid:87)(cid:85)(cid:72)(cid:3)(cid:90)(cid:68)(cid:86)(cid:3)\nbuilt in 2009, beside the ECU production facility of",
            "faster than our respective markets. Cost and structural com- business.\npetitiveness, a strong product portfolio, and a balanced re-\ngional footprint are important factors here. We are systemat- Apart from innovation, Bosch Rexroth\u2019s strategy also focuses\nically expanding our global footprint with growth initiatives on its international footprint. The local-for-local strategy\nin countries such as the U.S., India, and China. At the same ( local value creation and supplier base) and improvements\ntime, adjustments are required in Europe. The weak con- to competitiveness require both investment and the optimi-\nstruction and mechanical engineering segments in key sales zation of structures. The aim is to further increase the share\nmarkets mean that additional measures are required. of value creation in China, India, and North America. In\nEurope, our regional footprint will be improved by moving\nfurther operations to more cost-effective locations where\nnecessary.\n4202\ntroper\nlaunnA"
        ],
        "response":"India and China were emerging as manufacturing hubs for the next millennium due to the availability of skilled engineers and robust domestic demand.",
        "reference":"India and China",
        "faithfulness":0.6666666667,
        "answer_relevancy":0.7788832852,
        "context_precision":0.8666666666,
        "context_recall":1.0
    },
    {
        "user_input":"What was the liquidity of the Bosch Group at year-end 2024?",
        "retrieved_contexts":[
            "ness unit at locations in the U.S., Italy, and Poland, as well as\non battery production in Miskolc, Hungary.\n4202\ntroper\nlaunnA\nGroup management report\nReport on economic position\n73\nThe Bosch Group Robert Bosch Stiftung Consolidated financial statements Additional information\nLiquidity Non-financial indicators\nThe Bosch Group is financially strong. Liquidity at year-end CO emissions\n2\nas per the consolidated statement of cash flows (cash and Once again in 2024, the Bosch Group with its more than\ncash equivalents) stood at 8.2 billion euros, compared with 450 locations worldwide was carbon-neutral overall (scopes\n7.4 billion euros the previous year. Cash flows from operating 1 and 2). In 2024, residual emissions of roughly 531,300 met-\nactivities fell to 7.0 billion euros or 7.7 percent of sales reve- ric tons of CO were offset through carbon credits to achieve\n2\nnue in 2024; the previous-year figure was 9.2 percent. In the this. Compared with the previous year\u2019s level, this is a de-",
            "1. After offsetting write-ups of EUR 0 million (previous year: EUR 63 million).\nCONTINUED NEXT PAGE\n4202\ntroper\nlaunnA\nConsolidated financial statements\nConsolidated statement of cash flows\n94\nThe Bosch Group Robert Bosch Stiftung Group management report Additional information\nCONTINUED FROM PAGE 94\n95 T 07\nin millions of euros\nNote 28 2024 2023\nAcquisition of non-controlling interests 16 \u20131\nBorrowing 782 7,141\nRepayment of financial liabilities \u20131,538 \u20131,887\nRepayment of lease liabilities \u2013675 \u2013588\nDividends paid \u2013452 \u2013704\nCash flows from financing activities (C) \u20131,867 3,961\nChange in liquidity (A+B+C) 561 1,180\nLiquidity at the beginning of the period (January 1) 7,443 6,459\nExchange-rate related change in liquidity 182 \u2013208\nChange in liquidity due to changes in the consolidated group 26 10\nChange in liquidity held for sale 11 2\nLiquidity at the end of the period (December 31) 8,223 7,443\n4202\ntroper\nlaunnA\nConsolidated financial statements\nConsolidated statement of cash flows\n95",
            "For the Bosch Group, it proved impossible to sidestep the difficult market situation in its\nmain areas of business and the weak global economy. The year 2024 was an outlier, with\nall our core markets underperforming at the same time. This particularly affected business\nin Europe. Against this backdrop, Bosch Group sales revenue and result are down on the\nprevious year. We cannot be satisfied with this. Our expectations for 2024 were therefore\nnot fulfilled. Sales revenue declined by 1.4 percent to 90.3 billion e uros in nominal terms\nand by 0.5 percent after adjusting for exchange-rate effects. Market developments affected\nall our business sectors. With the exception of the Consumer Goods business sector,\nsales revenue is down year on year, and below expectations in all business sectors. The\nIndustrial Technology business sector was hit particularly hard by market developments.\nFor 2024, the Bosch Group discloses an EBIT margin from operations of 3.5 percent. This",
            "The Bosch Group balance sheet total as of the December 31, placements, it is 6.31 percent. The average residual term to\n2024, reporting date stood at 112.8 billion euros, exceeding maturity of the schuldschein loans and registered bonds is\nthe previous year\u2019s level of 108.3 billion euros. Year on year, 4.00 years; for the bonds, it is 9.77 years. The average\nthe equity ratio rose 0.1 percentage points to 44.3 percent. re sidual term to maturity of the U.S. private placements is\nThe main reasons for the rise in balance sheet total are the 7.38 years.\nincrease in current assets and property, plant, and equip-\n4202\ntroper\nlaunnA\nGroup management report\nReport on economic position\n71\nThe Bosch Group Robert Bosch Stiftung Consolidated financial statements Additional information\nG 15 G 16\nCapital expenditure, 2020 \u2013 2024 Capital expenditure, 2020 \u2013 2024\nin millions of e uros as a percentage of sales revenue\n5,499 6.0\n5,122 5.6 5.7\n4,896\n5.0\n4.6\n3,949\n3,312",
            "associates fell to 75,307, compared with 79,376 at the end the corporate sector for research and advance engineering\nof 2023. The Energy and Building Technology business sec- (\u201cOther activities\u201d) at year-end was 1,600, compared with\ntor employed 35,840 people at the end of the year, com- the previous-year figure of 1,627. Headcount decreased in all\npared with 36,402 at the end of the previous year. A total of regions. The percentage distribution of Bosch Group associ-\n40,869 associates are employed in corporate functions and ates by region is unchanged.\nservices as well as research and development, compared\nwith 40,799 in the previous year.\n4202\ntroper\nlaunnA\nGroup management report\nReport on economic position\n75\nThe Bosch Group Robert Bosch Stiftung Consolidated financial statements Additional information\nOutlook\nThe outlook for the 2025 fiscal year is marked by great uncertainty with respect to the\nfurther development of global trade. In our forecasts, this uncertainty can only be"
        ],
        "response":"The liquidity of the Bosch Group at year-end 2024 stood at 8.2 billion euros, compared with 7.4 billion euros the previous year.",
        "reference":"8.2 billion euros",
        "faithfulness":1.0,
        "answer_relevancy":1.0,
        "context_precision":1.0,
        "context_recall":1.0
    },
    {
        "user_input":"What was the amount of trade payables due in more than one year in 2024?",
        "retrieved_contexts":[
            "Notes to the consolidated financial statements\n131 22 \u2014 Trade payables Trade payables include payables of EUR 815 million (previ-\nous year: EUR 647 million) for which suppliers of the Bosch\nT 42\nGroup have concluded reverse factoring agreements. Of this\nin millions of euros total amount, suppliers have already received payments of\nEUR 526 million.\n2024 2023\nTrade payables 13,129 12,190\nThe term to maturity of the payables for which reverse factor-\nNotes payable 69 15\ning agreements have been concluded ranges between 0 and\n13,198 12,205\n120 days. The term to maturity for comparable trade pay-\nables ranges between 0 and 180 days.\nWith two partner banks, Bosch offers a worldwide reverse\nfactoring program that is open to all Bosch suppliers. Under Trade payables due in more than one year came to\nthis program, the banks handle payment processing for EUR 102 million (previous year: EUR 56 million).\nBosch and settle trade payables to participating suppliers.",
            "There are no \u201cunbilled\u201d and \u201cnot due\u201d trade Payables, hence the same are not disclosed in the ageing schedule.\n\nNote (ii): Disclosure under Micro, Small and Medium Enterprises Development Act, 2006.\n\nAs at As at\nMarch 31, 2024 and | March 31, 2023 and\nfor the year for the year\nended ended\nMarch 34, 2024 March 31, 2023\n\n(i) Poncipal amount remaining unpaid to any supplier as at the end of the accounting period\/ year\n(i) Interest due thereon remaining unpaid te any supplier as at the end of tne accounting period\/ year\n\n(i!) The amount of interest paic\u00a2 along with the amounts of the payment made to the supplier beyond the\nappointed day\n\n(iv) The amount of interest due and Payable for the period\/ year\n(v) The amount of interest accrued and remaining unpaid at the end of the accounting penod\/ year\n\n(vi) The amount of further interest due and payable even in the succeeding period\/ year, until such cate when the\ninterest dues as above are actually paid\n\nNote 7 (b): Other current liabilities",
            "T 29 T 31\nin millions of euros in millions of euros\n2024 2023 2024 2023\nRemuneration 24,514 21,980 Bank balances (term up to 90 days) 8,222 7,443\nSocial security costs 3,937 3,821 Cash 1 0\nPost-employment benefit costs 1,001 1,020 8,223 7,443\n29,452 26,821\nDisclosures on restricted cash and cash equivalents are pro-\nHeadcount vided in note 28 \u201cStatement of cash flows.\u201d\nT 30\n15 \u2014 Trade receivables\nThe accounting policies applicable to trade receivables are\nAnnual Annual explained in note 30 \u201cAdditional disclosures on financial\naverage average\ninstruments.\u201d\n2024 2023\nEU countries 217,992 221,376\nIn the reporting year, trade receivables came to\nRest of Europe 33,217 33,536\nEUR 17,536 million (previous year: EUR 17,081 million). Trade\nAmericas 53,072 53,606\nreceivables due in more than one year amounted to\nAsia, Africa, Australia 120,384 120,849\nEUR 10 million (previous year: EUR 14 million).\n424,665 429,367\nInformation about loss allowances on trade receivables is",
            "(vi) The amount of further interest due and payable even in the succeeding period\/ year, until such cate when the\ninterest dues as above are actually paid\n\nNote 7 (b): Other current liabilities\n\nStatutory dues\n\nAs at As at\nMarch 31, 2024 March 31, 2023\nSEE SE\nfee eS\n\n\nMICO TRADING PRIVATE LIMITED\n\nNotes to the Ind AS Financial Statements for the year ended on March 31, 2024 [Rs. in Thousands (TINR)]\nNotes:\n\nOther income\n\nFor the period ended\nMarch 31, 2024\n28\n\nFor the year ended\nMarch 31, 2023\n37\n\nInterest income on bank deposits\nIT refund recewed\n\nNote 9: Other expenses\n\nFor the period endod| For the year ended\n\nMarch 31, 2024 March 34, 2023\nProfessional and other charges [Refer note (a) below] 29 36\nRates and taxes 0 Ey\nTotal 29 7\n\n(a) Professional and other charges includes\u2019\n\nFor the pariod ended\nMarch 31, 2024\n\nFor the year ended\nMarch 31, 2023 4\n\nAuditors' Romuneration\nStatutory audit fees.\n\n24",
            "in millions of euros\nThe credit risk from customer receivables is recorded and\n2024 2023\nmonitored on an ongoing basis. Responsibilities and duties\nTrade receivables (before offsetting\nrelating to credit risks are governed by an internal directive. of credit notes) 18,346 17,865\nThis mainly concerns the stipulation of payment terms, fix- Offsetting of credit notes \u2013810 \u2013784\ning of credit limits, release of deliveries, and receivables\nTrade receivables (carrying amount) 17,536 17,081\nmonitoring.\nFinancial guarantee contracts\n(received) \u20132,592 \u20132,203\nThe credit risk for trade receivables is reduced by processing\nRemaining credit risk 14,944 14,878\ninvoices with the corresponding credit notes in a single work\nstep; the net amount is reported in the statement of financial\nposition. This procedure is only performed if there is a legal\nright to offset and the customer intends to settle the receiv-\nable on a net basis or to settle the receivable by offsetting"
        ],
        "response":"The amount of trade payables due in more than one year in 2024 was EUR 102 million.",
        "reference":"EUR 102 million",
        "faithfulness":1.0,
        "answer_relevancy":1.0,
        "context_precision":0.9999999999,
        "context_recall":1.0
    },
    {
        "user_input":"What was the amount of impairment losses attributable to plant and equipment in the reporting year?",
        "retrieved_contexts":[
            "costs. recognized in the context of business combinations is gener-\nally between ten and twenty years, in exceptional cases up\nPurchase commitments for items of property, plant, and to fifty years.\nequipment amounted to EUR 903 million (previous year:\nEUR 1,489 million); there were no restrictions on title in Goodwill is tested annually for impairment. Intangible assets\neither the reporting year or the previous year. Government subject to wear and tear are only tested for impairment if\ngrants for assets of EUR 31 million (previous year: EUR 58 mil- there is an indication that they may be impaired. Impairment\nlion) were deducted from the additions in the reporting year. losses are recorded in accordance with IAS 36 if the recover-\nable amount of the asset concerned has fallen below its\nInvestment property comprises rented land and buildings carry ing amount. Impairment losses are reversed if the rea-",
            "122 Inventories break down as follows: Depreciation is based on the following ranges of useful lives:\nT 35 T 36\nin millions of euros\nUseful life\n2024 2023\nBuildings 10 \u2013 50 years\nRaw materials, consumables,\nand supplies 6,028 5,879 Plant and equipment 8 \u2013 11 years\nWork in process 3,727 3,377 Other equipment, fixtures, and furniture 3 \u2013 25 years\nFinished goods and merchandise 5,833 5,842\nPrepayments 86 86\nIn accordance with IAS 36 Impairment of Assets, impairment\n15,674 15,184\nlosses are recorded on property, plant, and equipment if\ntheir recoverable amount has fallen below their carrying\nIn the reporting year, the change in impairment losses of amount. Impairment losses are reversed if the reasons for\nEUR 120 million was recognized as income in profit or loss the impairment loss from previous years no longer apply.\n(previous year: expense of EUR 31 million). No inventories Repair costs are recognized in the income statement.\nwere pledged as collateral.",
            "Grund s\u00e4tze f\u00fcr die Ermittlung der Verkehrswerte von Grund-\n\u2013 Land and buildings: EUR 37 million (previous year: st\u00fccken: Ordinance on principles to assess the market value\nEUR 3 million), of land] and taking the current fabric and market values of\n\u2013 Plant and equipment: EUR 34 million (previous year: the individual properties into account. Rental income from\nEUR 1 million), investment property came to EUR 5 million (previous year:\n\u2013 Other equipment, furniture, and fixtures, assets EUR 5 million), maintenance expenses totaled EUR 2 million\nunder construction: EUR 75 million (previous year: (previous year: EUR 2 million).\nEUR 2 million).\n21 \u2014 Intangible assets\nThe impairment losses of the reporting year contain an Acquired and internally generated intangible assets are rec-\namount of EUR 94 million attributable to plant and equip- ognized pursuant to IAS 38 Intangible Assets if a future eco-",
            "Impairment losses on capitalized\ndevelopment cost 65 1\n7,807 7,331 Sundry other operating income in the reporting year includes\nincome from compensation payments of EUR 201 million\nand a gain of EUR 132 million on the initial measurement at\nCost of materials amounted to EUR 42,898 million in the fair value of an investment previously accounted for using\nreporting year (previous year: EUR 43,839 million). the equity method.\n4202\ntroper\nlaunnA\n111\nThe Bosch Group Robert Bosch Stiftung Group management report Consolidated financial statements Additional information\nNotes to the consolidated financial statements\n112 Government grants are recognized pursuant to IAS 20 Ac- \u201cExpenses from derivatives\u201d includes expenses from foreign\ncounting for Government Grants and Disclosure of Govern- exchange and commodity derivatives allocated to operating\nment Assistance only if it is sufficiently certain that the assis- activities.\ntance will be granted and the conditions attached to the",
            "impairment loss on goodwill.\nT 40\nin millions of euros\n1 percentage-\npoint increase\n10 percent in the\ndecrease after-tax\nDivision Reportable segment in EBIT discount rate\nElectrified Motion Mobility \u201372 \u201372\nMobility Electronics Mobility \u2013136 \u2013136\nDrive and Control Technology Industrial Technology \u2013226 \u2013299\nBuilding Technologies Energy and Building Technology \u20137 \u201330\n4202\ntroper\nlaunnA\n129\nThe Bosch Group Robert Bosch Stiftung Group management report Consolidated financial statements Additional information\nNotes to the consolidated financial statements\n130 A reduction in the growth rate of 0.5 percentage points Goodwill of EUR 6,499 million (previous year: EUR 6,617 mil-\nwould not have resulted in an impairment loss. lion) is attributable to the divisions (cash-generating units)\nas follows:\nT 41\nin millions of euros\nDivision Reportable segment 2024 2023\nElectrified Motion\n(formerly Electrical Drives) Mobility 72 74\nMobility Aftermarket\n(formerly Automotive Aftermarket) Mobility 378 363"
        ],
        "response":"The amount of impairment losses attributable to plant and equipment in the reporting year was EUR 94 million.",
        "reference":"EUR 94 million",
        "faithfulness":1.0,
        "answer_relevancy":1.0,
        "context_precision":0.3333333333,
        "context_recall":1.0
    },
    {
        "user_input":"In what year was the Bosch Group founded?",
        "retrieved_contexts":[
            "one start? Read on\u2026.\n\u201cIt has always been an unbearable thought to me, that someone could prove,\non testing one of my products, that I produce anything of inferior quality. I have,\ntherefore, always tried to let only such work go out, that would stand any objective\ntest, work that was of the very best quality.\u201d\n- Robert Bosch\n(1861-1942)\n11 | \nNone | \n12\n1922 \u2013 1951\nColonial era and\nIndependence\nFounded in 1886, the Bosch Group is more than\n128 years old today. By 1922, the humble workshop\nfounded by Robert Bosch had expanded considerably,\ninitially by manufacturing and marketing their trademark\ninvention \u2013 the high-voltage Bosch magneto ignition\ndevice. After the damage wrought by World War I, Bosch\nestablished agencies in the U.K., France, Argentina,\nSouth Africa, Japan and China. India was also in the\nplan.",
            "stationary engines. His master craftsman, Arnold Zahringer, ingeniously came up with a\nsimple solution which used a smaller oscillating sleeve inside the magneto instead of the\narmature. From then onwards, the magneto ignition device achieved commercial success.\nThis happened during the mid-1890s.\n13\n | 1922 \u2013 1951\nColonial era and\nIndependence\nFounded in 1886, the Bosch Group is more than\n128 years old today. By 1922, the humble workshop\nfounded by Robert Bosch had expanded considerably,\ninitially by manufacturing and marketing their trademark\ninvention \u2013 the high-voltage Bosch magneto ignition\ndevice. After the damage wrought by World War I, Bosch\nestablished agencies in the U.K., France, Argentina,\nSouth Africa, Japan and China. India was also in the\nplan.",
            "1 %\nidated subsidiaries and regional companies in more than Robert Bosch GmbH 5 %\n60 countries. The parent company is Robert Bosch GmbH, ERBO II GmbH \/\nBosch family\nwhich is domiciled in Stuttgart, Germany. It started out as\n\u201cWorkshop for Precision Mechanics and Electrical Engineer-\ning,\u201d founded in Stuttgart in 1886 by Robert Bosch (1861\u2013\n1942). Robert Bosch Stiftung GmbH has been the majority\nshareholder in Robert Bosch GmbH since 1964.\n94 %\nDespite holding roughly 94 percent of the share capital, this\nRobert Bosch\nlimited liability company with a charitable purpose has no Stiftung GmbH\ninfluence on the strategic or business orientation of the\nBosch Group. A further roughly 5 percent of the share capital\nis held by the not-for-profit ERBO II GmbH, established by G 03\nthe founder\u2019s descendants, and some 1 percent by Robert Shareholders of Robert Bosch GmbH\nBosch GmbH itself. Of the voting rights, some 93 percent are Voting rights",
            "The company was set up in Stuttgart in 1886 by Robert Bosch (1861\u20131942) as\n\u201c Workshop for Precision Mechanics and Electrical Engineering.\u201d The special ownership\nstructure of Robert Bosch GmbH guarantees the entrepreneurial freedom of the\nBosch Group, making it possible for the company to plan over the long term and to\nundertake significant upfront investments in the safeguarding of its future. Ninety-four\npercent of the share capital of Robert Bosch GmbH is held by Robert Bosch Stiftung\nGmbH, a limited liability company with a charitable purpose. The remaining shares are\nheld by Robert Bosch GmbH and by a corporation owned by the Bosch family. The\nmajority of voting rights are held by Robert Bosch Industrietreuhand KG.\n4202\ntroper\nlaunnA\nThe Bosch Group\nBosch at a glance\nRobert Bosch Stiftung Group management report Consolidated financial statements Additional information\nForeword\n08\nLadies and gentlemen,\n\u201cAmbitions,\u201d the title of our annual report, is intended as a",
            "companies in some 60 countries. Including sales and service partners,\nBosch\u2019s global manufacturing and sales network covers nearly every\ncountry in the world. The basis for the company\u2019s future growth is its\ninnovative strength. At 120 locations across the globe, Bosch employs\na huge number of associates in research and development.\nThe company was set up in Stuttgart in 1886 by Robert Bosch\n(1861-1942) as \u201cWorkshop for Precision Mechanics and Electrical\nEngineering\u201d. The special ownership structure of Robert Bosch GmbH\nguarantees the entrepreneurial freedom of the Bosch Group, making it\npossible for the company to plan over the long term and to under-\ntake significant up-front investments in the safeguarding of its future.\nNinety-two percent of the share capital of Robert Bosch GmbH is held\nby Robert Bosch Stiftung GmbH, a charitable foundation. The majority\nof voting rights are held by Robert Bosch Industrietreuhand KG, an"
        ],
        "response":"The Bosch Group was founded in 1886.",
        "reference":"1886",
        "faithfulness":1.0,
        "answer_relevancy":0.9781801744,
        "context_precision":1.0,
        "context_recall":1.0
    },
    {
        "user_input":"In what year did the ten-millionth single-cylinder pump get produced?",
        "retrieved_contexts":[
            "Engineers (ISME).\nFrom the second half of the 1980s, a range of initiatives were taken to\nmodernise the plants. Commercial licence for the sale of special purpose\nmachines was obtained in 1985. The three-millionth multi-cylinder pump\nfor diesel engines rolled off production lines in 1987, and the ten-millionth\nsingle-cylinder pump was made in the year after.\nAbove: Starter Motor and Alternator\nLeft: An aerial view of the Naganathapura plant which is located 11 km\naway from the Bangalore plant.\n37 | \nNone | \n(cid:49)(cid:72)(cid:90)(cid:3)(cid:83)(cid:79)(cid:68)(cid:81)(cid:87)(cid:3)(cid:68)(cid:87)(cid:3)(cid:49)(cid:68)(cid:74)(cid:68)(cid:81)(cid:68)(cid:87)(cid:75)(cid:68)(cid:83)(cid:88)(cid:85)(cid:68)(cid:3)(cid:75)(cid:72)(cid:79)(cid:83)(cid:86)(cid:3)(cid:71)(cid:76)(cid:89)(cid:72)(cid:85)(cid:86)(cid:76)(cid:73)(cid:92)(cid:3)(cid:83)(cid:85)(cid:82)(cid:71)(cid:88)(cid:70)(cid:87)(cid:3)(cid:85)(cid:68)(cid:81)(cid:74)(cid:72)",
            "1969 1996\nPilot plant set up in Nashik for the manufacture of nozzles Production of Blaupunkt brand of car audio systems at\nand nozzle holders the Naganathapura plant\n1974 1998\nRexroth Maneklal Industries Ltd., (today Bosch Rexroth Robert Bosch India Ltd., 100% owned subsidiary of\nIndia Ltd.) begins operations at Ahmedabad Robert Bosch GmbH begins software activities\n20-millionth single-cylinder pump produced\n1988\n1999\n10-millionth single-cylinder pump produced\nNew plant at Jaipur manufactures distributor-type\n1989\ndiesel-injection pumps\nNew plant at Naganathapura, near Bangalore, 2000\nmanufactures auto electricals\nFirst-of-its-kind automotive R&D centre \u2013 Technical\n1993\nCenter India (previously Mico Application Center)\nset up in Bangalore\nManufacture of Bosch electric power tools at the\nNaganathapura plant\n67\nHans L. Merkle and Bhailal C Patel (in the centre, garlanded) amongst Hubert Zimmerer, D. N. Vatcha and members of Mico management team when Mico",
            "Naganathapura plant\n67\nHans L. Merkle and Bhailal C Patel (in the centre, garlanded) amongst Hubert Zimmerer, D. N. Vatcha and members of Mico management team when Mico\ncelebrated its Silver Jubilee in 1976.\n1965 1995\nManufacture of Special Purpose Machines Packaging technology business begins at Bangalore\n1969 1996\nPilot plant set up in Nashik for the manufacture of nozzles Production of Blaupunkt brand of car audio systems at\nand nozzle holders the Naganathapura plant\n1974 1998\nRexroth Maneklal Industries Ltd., (today Bosch Rexroth Robert Bosch India Ltd., 100% owned subsidiary of\nIndia Ltd.) begins operations at Ahmedabad Robert Bosch GmbH begins software activities\n20-millionth single-cylinder pump produced\n1988\n1999\n10-millionth single-cylinder pump produced\nNew plant at Jaipur manufactures distributor-type\n1989\ndiesel-injection pumps\nNew plant at Naganathapura, near Bangalore, 2000\nmanufactures auto electricals\nFirst-of-its-kind automotive R&D centre \u2013 Technical\n1993",
            "- Hans L. Merkle expressed the foundation of the Indo-German relationship in\nvehicles hauled goods and passengers in road transport.\nhis speech during the Silver Jubilee commemoration event.\nTens of thousands of Mico-equipped industrial, locomotive\nand marine engines operated in the country.\nAbove Right: A legacy follows as N. Shankar, foreman of single-cylinder pump\nMico celebrated its Silver Jubilee in the year 1976. Including assembly section, garlands S. L. Kirloskar, Chairman of Kirloskar Oil Engines\nLtd., Pune, before presenting him with the 2-millionth single-cylinder pump in\nassociates* from the Bangalore and Nashik plants, and",
            "- Hans L. Merkle expressed the foundation of the Indo-German relationship in\nvehicles hauled goods and passengers in road transport.\nhis speech during the Silver Jubilee commemoration event.\nTens of thousands of Mico-equipped industrial, locomotive\nand marine engines operated in the country.\nAbove Right: A legacy follows as N. Shankar, foreman of single-cylinder pump\nMico celebrated its Silver Jubilee in the year 1976. Including assembly section, garlands S. L. Kirloskar, Chairman of Kirloskar Oil Engines\nLtd., Pune, before presenting him with the 2-millionth single-cylinder pump in\nassociates* from the Bangalore and Nashik plants, and"
        ],
        "response":"The ten-millionth single-cylinder pump was produced in 1988.",
        "reference":"1988",
        "faithfulness":1.0,
        "answer_relevancy":0.973693665,
        "context_precision":1.0,
        "context_recall":1.0
    },
    {
        "user_input":"What was the profit after tax for the year 2024?",
        "retrieved_contexts":[
            "2024 2023\nfiscal years beginning after December 30, 2023. In addition,\nProfit before tax 2,728 3,976\nlaws were passed in some other countries to introduce a\nExpected income tax expense 818 1,193\nqualified domestic minimum tax. For the Bosch Group, the\nVariances due to tax rate \u2013173 \u2013274\nrelevant German and foreign rules are to be applied for the\nNon-deductible expenses 400 182\nfirst time for the fiscal year 2024.\nZero-rated income \u2013254 \u2013308\nTax credits \u2013109 \u2013123 In accordance with the rules on global minimum taxation, a\nRecognition\/measurement of deferred corporate group must pay a top-up tax for those countries in\ntax assets 509 407\nwhich its operating units\/entities based there achieve an ag-\nWithholding taxes 290 238 gregate effective tax rate of less than 15 percent calculated\nTax effects not related to the reporting in accordance with the rules of the German Minimum Tax\nyear \u20132 23\nAct. The levying of a top-up tax is intended to ensure that the",
            "Loss before income tax expense\n\nTax at the Indian tay rate of 26.00% - -\n\nNon recognition of deferred tax assets on carry forward of losses\nIncome tax expense\n\nNote 11: Earnings per share\n\nFor the period ended| For the year ended\nMarch 34, 2024\n\nProfit\/ (Loss) after tax (A) (TINR)\nWeighted average number of equity shares outstanding during the period\/ year (B)\nNominal value cf equity shares (INR)\n\nBasic and diluted earnings per share of face value of Rs. 10 each (A)! (8\n\nCANA REG\n5 iO\nCHARTERED @\n\n\nMICO TRADING PRIVATE LIMITED\n\nNotes to the Ind AS Financial Statements for the year ended on March 31, 2024 [Rs. in Thousancs (TINR)]\n\nNote12: Related party disclosures\nUkimate Holding Company: Robert Bosch GmbH, Federal Republic of Germany\nHolding Company. Bosch Limited, India\n\nThe Company has not entered into any related party transaction during the period as well as Previous year and there are no outstancing balances as at March 31, 2024\nand March 31, 2023,",
            "2024 2023\nEUR 7,850 million (previous year: EUR 8,051 million). If these\nTemporary differences 2,958 2,715\nprofits are distributed, this could lead to an income tax or\nTax losses 13,341 11,846\nwithholding tax expense at Robert Bosch GmbH or at the\nTax credits 7 3\nlevel of intermediate holding entities.\n16,306 14,564\nDeferred taxes recognized in other comprehensive income in\nThe utilization of unused tax losses and tax credits for which the fiscal year are presented in the following table:\nno deferred tax assets have been recognized to date resulted\nT 27\nin a reduction of the current tax expense in the reporting year\nof EUR 2 million (previous year: EUR 4 million). in millions of euros\n2024 2023\nThe unused tax losses for which no deferred taxes were rec-\nChange in equity instruments \u20136 \u20135\nognized expire as follows:\nChange in debt instruments \u20138 \u20133\nT 26 Remeasurement of pension provisions 0 \u20133\nin millions of euros \u201314 \u201311\n2024 2023",
            "(a) Professional and other charges includes\u2019\n\nFor the pariod ended\nMarch 31, 2024\n\nFor the year ended\nMarch 31, 2023 4\n\nAuditors' Romuneration\nStatutory audit fees.\n\n24\n\nNote 10: Income tax expense\nThis note provides an analysis of the Company's income tax expense.\n\n(2) Income tax expense\n\n| [For the period ended| For the year ended\nMarch 31, 2024 \u2014 March 31, 2023\n\nCurrent tax\nCurrent tax on profit! (loss) for the penod\/ year -\n\nTotal current tax expenses <= =\n\nDeferred tax\nDecrease\/ (increase) in deferred tax assets\n\n. (Decrease) Increase in deferred tax liabilities\n\nTotal deferred tax expenses\/(benefit)\n\nIncome tax ex;\n\n(b) Reconciliation of tax expenses and the accounting profit multiplied by tax rate:\n\nFor the period ended\nMarch 31, 2024\n\nFor the year ended\nMarch 31, 2023\n\nLoss before income tax expense\n\nTax at the Indian tay rate of 26.00% - -\n\nNon recognition of deferred tax assets on carry forward of losses\nIncome tax expense\n\nNote 11: Earnings per share",
            "Other operating expenses 10 \u20132,001 \u20132,029\nResult from entities included at equity 6 3 6\nEarnings before financial result and taxes (EBIT) 2,796 4,503\nFinancial income 11 3,547 3,980\nFinancial expenses 11 \u20133,615 \u20134,507\nFinancial result \u201368 \u2013527\nProfit before tax 2,728 3,976\nIncome taxes 12 \u20131,396 \u20131,336\nProfit after tax 1,332 2,640\nof which attributable to non-controlling interests 546 539\nof which attributable to shareholders of the parent company 786 2,101\n4202\ntroper\nlaunnA\nConsolidated financial statements\nConsolidated income statement\n89\nThe Bosch Group Robert Bosch Stiftung Group management report Additional information\nConsolidated statement of comprehensive income\n90\nfor the period from January 1 to December 31, 2024\nT 04\nin millions of euros\n2024 2023\nProfit after tax 1,332 2,640\nChange in debt instruments, measured at fair value 16 384\nreclassified to profit or loss 31 189\nCurrency translation of subsidiaries outside the euro zone 1,019 \u2013919"
        ],
        "response":"The profit after tax for the year 2024 was 1,332 million euros.",
        "reference":"1,332 million euros",
        "faithfulness":1.0,
        "answer_relevancy":1.0,
        "context_precision":0.7,
        "context_recall":1.0
    },
    {
        "user_input":"What was the sales revenue in millions of euros for the year 2022?",
        "retrieved_contexts":[
            "ences in our business sectors\u2019 fortunes mean that our sales EBIT from operations comes to 3.1 billion euros, following\nrevenue structure has changed. The share of sales revenue the previous-year figure of 4.8 billion euros. Unlike the EBIT\n4202\ntroper\nlaunnA\nGroup management report\nReport on economic position\n66\nThe Bosch Group Robert Bosch Stiftung Consolidated financial statements Additional information\nG 11 G 12\nResearch and development cost, Research and development cost,\n2020 \u2013 2024 2020 \u2013 2024\nin millions of e uros as a percentage of sales revenue\n7,807 8.6\n7,224 7,331 8.2 7.8 8.2 8.0\n5,890 6,110\n2020 2021 2022 2023 2024 2020 2021 2022 2023 2024\ndisclosed in the income statement, and as in previous years, tribution margin needed to cover structural costs is insuffi-\nthe calculation of the result from operations disregards the cient. Instead of a 1.4 percent drop in sales, we had assumed",
            "G 15 G 16\nCapital expenditure, 2020 \u2013 2024 Capital expenditure, 2020 \u2013 2024\nin millions of e uros as a percentage of sales revenue\n5,499 6.0\n5,122 5.6 5.7\n4,896\n5.0\n4.6\n3,949\n3,312\n2020 2021 2022 2023 2024 2020 2021 2022 2023 2024\nUnder our revolving 2.0 billion U.S. dollar commercial pa- total 0.9 billion euros, following a previous-year figure of\nper program, short-term issuances of roughly 500 million 1.5 billion euros. Thanks to our comfortable liquidity posi-\nU.S. dollars are outstanding as of the reporting date. To fur- tion, we have ample financial resources at our disposal. We\nther boost our financial reserves, the existing bilateral U.S. invested 631 million euros in intangible assets, compared\ncredit lines were increased by 300 million euros to 1.25 bil- with 620 million e uros the previous year.\nlion U.S. dollars during the reporting period. There is also a",
            "following the extraordinary boom during the peak phase of 27.9 28.0\nthe coronavirus pandemic appears to be coming to an end.\n16.9 17.8\nBusiness developments\nDevelopment of sales 2023 2024 2023 2024 2023 2024\nBosch Group sales revenue Europe Americas Asia Pacific 1\nIn the Bosch Group, we achieved sales revenue of 90.3 bil-\nlion euros in 2024, compared with 91.6 billion euros in the 1. Including other countries and Africa.\nprevious year. Year on year, sales revenue fell a nominal\nG 08\n1.4 percent, or 0.5 percent after adjusting for exchange-rate\nSales revenue by region, 2024\neffects. The development of sales revenue thus fell signifi-\npercentage figures\ncantly short of the 5 to 7 percent growth forecast for 2024.\nHere, the pivotal factor was the weakness of our core mar-\nkets, which developed more weakly than global economic\noutput as a whole. The total negative impact of exchange- 31.0 %\nrate effects on sales revenue is some 0.8 billion euros. These Asia Pacific 1",
            "ure is 4.6 percent. Germany was affected to a greater degree year. The share generated by Asia Pacific (including other\nthan other countries. In contrast, sales revenue in the Amer- countries and Africa) increased to 31.0 percent, following\nicas rose by a nominal 4.8 percent to 17.8 billion euros, up the previous year\u2019s 30.4 percent.\nG 09\nSales revenue by business sector\nin billions of euros Total 2024\n90.3\nTotal 2023\n91.6\n56.2 55.8\n19.9 20.3\n7.4 6.4 7.7 7.5 0.4 0.3\n2023 2024 2023 2024 2023 2024 2023 2024 2023 2024\nMobility Industrial Consumer Goods Energy and Building Other activities\nTechnology Technology\n4202\ntroper\nlaunnA\nGroup management report\nReport on economic position\n64\nThe Bosch Group Robert Bosch Stiftung Consolidated financial statements Additional information\nSales revenue by business sector G 10\nAll business sectors felt the effects of weak developments Sales revenue by business sector, 2024",
            "Sales revenue by business sector G 10\nAll business sectors felt the effects of weak developments Sales revenue by business sector, 2024\nin their core markets, albeit to varying degrees. The business percentage figures\nsectors did not reach the forecasts for sales revenue growth.\n8.3 %\nEnergy and Building Technology\nIn light of the global decline in vehicle production, sales rev- 7.1 %\nenue in the Mobility business sector was 55.8 billion euros, Industrial\nTechnology\nand thus a nominal 0.7 percent below the previous year\u2019s\n56.2 billion euros. Adjusted for exchange-rate effects, sales\nrevenue grew 0.2 percent. The business sector thus fell\n90.3\nsignificantly short of its forecast growth corridor of 7 to 22.4 % billion euros\n9 percent. One main reason for this was weak market de- Consumer\nGoods 61.8 %\nvelopments, especially in Europe. This region accounts for Mobility\n42 percent of our sales revenue. In addition, sales revenue\n0.4 %"
        ],
        "response":"The sales revenue for the year 2022 was 91.6 billion euros, which is equivalent to 91,600 million euros.",
        "reference":"88,201",
        "faithfulness":0.5,
        "answer_relevancy":0.8281990088,
        "context_precision":0.0,
        "context_recall":0.0
    },
    {
        "user_input":"What is the percentage share of capital for Robert Bosch Lanka (Pvt.) Ltd. in Sri Lanka?",
        "retrieved_contexts":[
            "Diesel Electric (South Africa) (Pty) Ltd. Brits 100.0\nDiesel Electric Holdings (Pty) Ltd. Brits 100.0\nH\u00e4gglunds Drives South Africa (Pty.) Ltd. Fourways 100.0\nSri Lanka Robert Bosch Lanka (Pvt.) Ltd. Colombo 100.0\nThailand Bosch Rexroth (Thailand) Ltd. Rayong 100.0\nWhatsEgg (Thailand) Co. Ltd. Bangkok 70.0\nTunisia Robert Bosch Tunisie S.A.R.L. Tunis 100.0\n4202\ntroper\nlaunnA\n215\nThe Bosch Group Robert Bosch Stiftung Group management report Consolidated financial statements Additional information\nList of shareholdings of the Bosch Group\nB. Joint ventures and associated entities 216\n1. Entities measured using the equity method\nPercentage share\nRegion \/ country Company name Registered office of capital\nGermany Bosch BASF Smart Farming GmbH Cologne 50.0\nBS Systems GmbH & Co. KG Zusmarshausen 50.0\nMAGURA Bosch Parts & Services GmbH & Co. KG N\u00fcrtingen 50.0\nplc2 Design GmbH Endingen am Kaiserstuhl 25.0\nPercentage share\nRegion \/ country Company name Registered office of capital\nEurope",
            "the founder\u2019s descendants, and some 1 percent by Robert Shareholders of Robert Bosch GmbH\nBosch GmbH itself. Of the voting rights, some 93 percent are Voting rights\nheld by Robert Bosch Industrietreuhand KG, which itself Percentage figures\nholds a capital share of 0.01 percent. The approximately\n7 percent of voting rights remaining are held by the founder\u2019s 7 %\nBosch family\ndescendants. This ownership structure guarantees the\nBosch Group\u2019s entrepreneurial independence.\nWith a workforce of more than 417,850 associates worldwide\nat year-end 2024, the Bosch Group is divided into four busi-\nness sectors: Mobility, Industrial Technology, Consumer\nGoods, and Energy and Building Technology. Reporting is 93 %\nRobert Bosch\nsegmented in the same way.\nIndustrie-\ntreuhand KG\n4202\ntroper\nlaunnA\nGroup management report\nFundamental information about the group\n39\nThe Bosch Group Robert Bosch Stiftung Consolidated financial statements Additional information",
            "49,600 metric tons of CO\u2082, or 8.5 percent.3 significant up-front investments in the safeguarding of its\nfuture. 94 percent of the share capital of Robert Bosch\nThe Bosch Group comprises Robert Bosch GmbH and its GmbH is held by Robert Bosch Stiftung GmbH, a charitable\nroughly 490 subsidiary and regional companies in more foundation. The remaining shares are held by Robert Bosch\nthan 60 countries. Including sales and service partners, GmbH and by a corporation owned by the Bosch family. The\nBosch\u2019s global manufacturing, engineering, and sales net- majority of voting rights are held by Robert Bosch Industrie-\nwork covers nearly every country in the world. Bosch\u2019s in- treuhand KG. Further information on the organization of the\nnovative strength is key to the company\u2019s further develop- Bosch Group, the activities of the business sectors, and the\nment. Bosch employs around 86,800 associates in research company\u2019s economic situation, can be found in the current",
            "218\nPercentage share\nRegion \/ country Company name Registered office of capital\nAsia Pacific (including\nother countries)\nAustralia The Yield Technology Solution Pty. Ltd. Hobart 28.7\nChina HEFEI M&B Air Conditioning Equipment Co., Ltd. Heifei 40.0\nIndia AMP Energy C&I Eight Private Limited New Delhi 29.4\nAMP Solar Infrastructure Private Limited New Delhi 26.0\nAutozilla Solutions Pvt. Ltd. Hyderabad 26.0\nPrebo Automotive Pte. Ltd. Pune 40.0\nSimyog Technology Pvt. Ltd. Bengaluru 24.7\nIsrael Electra Industries Ltd. Rishon LeZion 40.0\n4202\ntroper\nlaunnA\n218\nThe Bosch Group Robert Bosch Stiftung Group management report Consolidated financial statements Additional information\nList of shareholdings of the Bosch Group\nC. Other investments 219\nPercentage share\nRegion \/ country Company name Registered office of capital\nAsia Pacific (including\nother countries)\nChina Boyuan (Shanghai) Investment Management Co., Ltd. Shanghai 50.0",
            "PT Robert Bosch Retail Indonesia Jakarta 100.0\n4202\ntroper\nlaunnA\n213\nThe Bosch Group Robert Bosch Stiftung Group management report Consolidated financial statements Additional information\nList of shareholdings of the Bosch Group\n214\nPercentage share\nRegion \/ country Company name Registered office of capital\nIran Bosch Tejarat Pars Tehran 100.0\nIsrael Robert Bosch Technologies Israel Ltd. Tel Aviv 100.0\nJapan Bosch Service Solutions Corporation Tokyo 100.0\nITK Engineering Japan, Inc. Tokyo 100.0\nKanto Seiatsu Kogyo Co., Ltd. Honjo 92.9\nKenya Robert Bosch East Africa Ltd. Nairobi 100.0\nKorea Elmo Motion Control APAC Ltd. Hwaseong 100.0\nLaos Robert Bosch (Lao) Sole Co., Ltd. Vientiane Capital 100.0\nMalaysia Robert Bosch (Penang) Sdn. Bhd. Penang 100.0\nMorocco Bosch Rexroth Morocco S.A.R.L. Casablanca 100.0\nNew Zealand Bosch Rexroth Ltd. Auckland 100.0\nRobert Bosch Ltd. Auckland 100.0\nNigeria Robert Bosch Limited Lagos 100.0\nOman Robert Bosch Muscat Sole Proprietor Company Muscat 100.0"
        ],
        "response":"The percentage share of capital for Robert Bosch Lanka (Pvt.) Ltd. in Sri Lanka is 100.0%.",
        "reference":"100.0",
        "faithfulness":1.0,
        "answer_relevancy":1.0,
        "context_precision":0.7,
        "context_recall":1.0
    },
    {
        "user_input":"What company sold the trade components of the Blaupunkt brand in 2008?",
        "retrieved_contexts":[
            "Blaupunkt brand, owned by the Bosch Group. were also considered as original equipment for all leading\nautomobiles of the world.\nTo start with, three car audio systems \u2013 Arizona, Munich\nand Jackson \u2013 were made in India mainly for aftermarket Soon in India, Blaupunkt* became the original equipment\nsales. Shortly, Radio 620 was supplied to General Motors, supplier to Tata Motors, Mahindra Renault, Hindustan\nMotors and Reva Electric Car Co., in addition to being a\ngenuine accessory provider to General Motors India, Ford\nIndia and Mahindra & Mahindra.\n*However, as the years went by, Bosch Car Multimedia GmbH \u2013 which owned the\naftermarket business of the Blaupunkt brand \u2013 sold the trade components under the\nBlaupunkt brand to Munich-based industrial holding company AURELIUS in 2008.\nThis strategic realignment was necessary in order to concentrate on core\nOEM business.\nAbove: The Automotive Accessories business received a clear boost\nafter the liberalisation of Indian economy.",
            "(cid:88) Production of Blaupunkt in-car\nentertainment systems\n(cid:88) MICO becomes BOSCH\n(cid:88) Bosch packaging technology for\nthe Indian market (cid:88) Joint venture establishes\nElectrical Drives subsidiary\n(cid:88) India gets ready for Bosch\nPower Tools (cid:88) Automotive Electronics\nsubsidiary is next\n(cid:88) New plant at Jaipur\n(cid:88) Bosch achieves innovative\n(cid:88) Leveraging IT talent success by developing\ncomponents for Tata Nano\n(cid:88) Innovative A4000 Pump\n47 - R&D enables (cid:88) Engineering & Software\n2001 - 2005 technological edge, growth subsidiary makes big strides\nwith acquisitions in research\n(cid:88) Flagship subsidiary adds\nThermotechnology to its\noperations\n(cid:88) R&D facility enables\ntechnological edge (cid:88) Fully-owned subsidiary in\nBangladesh\n(cid:88) Acquisition of Rexroth in",
            "opportunity subsidiary at Bangladesh\n(cid:88) Production of Blaupunkt in-car\nentertainment systems\n(cid:88) MICO becomes BOSCH\n(cid:88) Bosch packaging technology for\nthe Indian market (cid:88) Joint venture establishes\nElectrical Drives subsidiary\n(cid:88) India gets ready for Bosch\nPower Tools (cid:88) Automotive Electronics\nsubsidiary is next\n(cid:88) New plant at Jaipur\n(cid:88) Bosch achieves innovative\n(cid:88) Leveraging IT talent success by developing\ncomponents for Tata Nano\n(cid:88) Innovative A4000 Pump\n47 - R&D enables (cid:88) Engineering & Software\n2001 - 2005 technological edge, growth subsidiary makes big strides\nwith acquisitions in research\n(cid:88) Flagship subsidiary adds\nThermotechnology to its\noperations\n(cid:88) R&D facility enables\ntechnological edge (cid:88) Fully-owned subsidiary in\nBangladesh\n(cid:88) Acquisition of Rexroth in",
            "1969 1996\nPilot plant set up in Nashik for the manufacture of nozzles Production of Blaupunkt brand of car audio systems at\nand nozzle holders the Naganathapura plant\n1974 1998\nRexroth Maneklal Industries Ltd., (today Bosch Rexroth Robert Bosch India Ltd., 100% owned subsidiary of\nIndia Ltd.) begins operations at Ahmedabad Robert Bosch GmbH begins software activities\n20-millionth single-cylinder pump produced\n1988\n1999\n10-millionth single-cylinder pump produced\nNew plant at Jaipur manufactures distributor-type\n1989\ndiesel-injection pumps\nNew plant at Naganathapura, near Bangalore, 2000\nmanufactures auto electricals\nFirst-of-its-kind automotive R&D centre \u2013 Technical\n1993\nCenter India (previously Mico Application Center)\nset up in Bangalore\nManufacture of Bosch electric power tools at the\nNaganathapura plant\n67\nHans L. Merkle and Bhailal C Patel (in the centre, garlanded) amongst Hubert Zimmerer, D. N. Vatcha and members of Mico management team when Mico",
            "Naganathapura plant\n67\nHans L. Merkle and Bhailal C Patel (in the centre, garlanded) amongst Hubert Zimmerer, D. N. Vatcha and members of Mico management team when Mico\ncelebrated its Silver Jubilee in 1976.\n1965 1995\nManufacture of Special Purpose Machines Packaging technology business begins at Bangalore\n1969 1996\nPilot plant set up in Nashik for the manufacture of nozzles Production of Blaupunkt brand of car audio systems at\nand nozzle holders the Naganathapura plant\n1974 1998\nRexroth Maneklal Industries Ltd., (today Bosch Rexroth Robert Bosch India Ltd., 100% owned subsidiary of\nIndia Ltd.) begins operations at Ahmedabad Robert Bosch GmbH begins software activities\n20-millionth single-cylinder pump produced\n1988\n1999\n10-millionth single-cylinder pump produced\nNew plant at Jaipur manufactures distributor-type\n1989\ndiesel-injection pumps\nNew plant at Naganathapura, near Bangalore, 2000\nmanufactures auto electricals\nFirst-of-its-kind automotive R&D centre \u2013 Technical\n1993"
        ],
        "response":"In 2008, Bosch Car Multimedia GmbH sold the trade components of the Blaupunkt brand to the Munich-based industrial holding company AURELIUS.",
        "reference":"Bosch Car Multimedia GmbH",
        "faithfulness":1.0,
        "answer_relevancy":0.9760924344,
        "context_precision":0.9999999999,
        "context_recall":1.0
    }
]